"","asin","asin_2","title_lower","chr_len_dynamic","real_name_norm","real_name_chr_len","is_the_same","need_fix","X..i.."
"102","B07Y8FDGDQ","B07Y8FDGDQ","imetec scaldasonno adapto piazza e mezza 150 x 120 cm, basso consumo, tecnologia brevettata, riscaldamento rapido, temperatura personalizzata, 100 % cotone, made in italy, comando con 6 temperature","197","0","1","FALSE","Fix Me Please My Lord",NA
"103","B07Y8GQMP5","B07Y8GQMP5","imetec scaldasonno adapto singolo 150 x 80 cm, basso consumo, riscaldamento rapido, temperatura personalizzata, 100% lana e merino, made in italy, tessuto antiscivolo, comando con 6 temperature","193","0","1","FALSE","Fix Me Please My Lord",NA
"104","B07Y8GCMLG","B07Y8GCMLG","imetec scaldasonno adapto matrimoniale 150 x 160 cm, basso consumo, riscaldamento rapido, temperatura personalizzata, 100% lana e merino, made in italy, 2 comandi separati, 6 temperature","186","0","1","FALSE","Fix Me Please My Lord",NA
"105","B07Y8FZ6GJ","B07Y8FZ6GJ","imetec scaldasonno adapto singolo 150 x 80 cm, riscaldamento rapido, temperatura costante e personalizzata, tessuto trapuntato anallergico, made in italy, comando con 6 temperature","180","0","1","FALSE","Fix Me Please My Lord",NA
"106","B07Y8GQVND","B07Y8GQVND","imetec scaldasonno adapto matrimoniale, basso consumo, riscaldamento rapido, temperatura personalizzata, tessuto trapuntato anallergico, made in italy, 2 comandi con 6 temperature, 150 x 160 cm","193","0","1","FALSE","Fix Me Please My Lord",NA
"107","B08HR1VGSR","B08HR1VGSR","imetec scaldasonno adapto maxi coprimaterasso singolo 195x90 cm, basso consumo, riscaldamento rapido, temperatura personalizzata, tessuto anallergico trapuntato, comando a 6 temperature","185","0","1","FALSE","Fix Me Please My Lord",NA
"108","B08HR23S41","B08HR23S41","imetec scaldasonno adapto maxi coprimaterasso matrimoniale 195x165 cm, basso consumo, riscaldamento rapido, temperatura personalizzata, tessuto anallergico trapuntato, doppio comando, 6 temperature","197","0","1","FALSE","Fix Me Please My Lord",NA
"109","B08J8XMFQN","B08J8XMFQN","imetec scaldasonno adapto maxi coprimaterasso matrimoniale 195 x 165 cm, basso consumo, riscaldamento rapido, temperatura personalizzata, 100% lana e merino, doppio comando, 6 temperature","187","0","1","FALSE","Fix Me Please My Lord",NA
"110","B0056BZZDA","B0056BZZDA","imetec scaldasonno singolo 150x80 cm, basso consumo, 50% lana e merino, 2 temperature, dispositivo sicurezza electro block, made in italy","137","0","1","FALSE","Fix Me Please My Lord",NA
"111","B0056C02MI","B0056C02MI","imetec scaldasonno matrimoniale 150x160 cm, 50% lana e merino, 2 temperature, dispositivo sicurezza electro block, made in italy","128","0","1","FALSE","Fix Me Please My Lord",NA
"112","B09GTTY863","B09GTTY863","imetec scaldasonno adapto maxi coprimaterasso matrimoniale 195x165 cm, basso consumo, riscaldamento rapido, temperatura personalizzata, 100% cotone percalle trapuntato, doppio comando, 6 temperature","198","0","1","FALSE","Fix Me Please My Lord",NA
"113","B078RL1X78","B078RL1X78","imetec bw03 boule elettrica cordless, tecnologia ceramica, riscaldamento ultrarapido, termostato di sicurezza, spia di ricarica","127","0","1","FALSE","Fix Me Please My Lord",NA
"114",NA,NA,NA,NA,NA,NA,NA,NA,NA
"115","B09CTZF711","B09CTZF711","imetec intellisense comfort, termoforo multiuso, cuscino termico, per schiena e addome, tasca per mani, rapido riscaldamento, tessuto anallergico, 5 temperature, electro block di sicurezza, lavabile","198","0","1","FALSE","Fix Me Please My Lord",NA
"116","B09KV6G5KT","B09KV6G5KT","imetec intellisense essential, termoforo multiuso, cuscino termico, 40x35 cm, tessuto anallergico, 5 temperature, electro block di sicurezza, lavabile, 40x35 cm","160","0","1","FALSE","Fix Me Please My Lord",NA
"117","B09CTZM9LJ","B09CTZM9LJ","imetec intellisense xl, termoforo extra large schiena e gambe, cuscino termico, 38x50 cm, tessuto micro peluche, 5 temperature, electro block di sicurezza, riscaldamento rapido, lavabile in lavatrice","199","0","1","FALSE","Fix Me Please My Lord",NA
"118","B09CTZV4TM","B09CTZV4TM","imetec intellisense cervical, termoforo per cervicale e spalle, cuscino termico, 47x52 cm, tessuto anallergico, 5 temperature, electro block di sicurezza, riscaldamento rapido, lavabile in lavatrice","198","0","1","FALSE","Fix Me Please My Lord",NA
"119","B0B8JFYZ34","B0B8JFYZ34","imetec intellisensefeet scaldapiedi, tecnologia intellisense, tessuto morbido, 5 temperature, autospegnimento, dispositivo sicurezza electro block, rivestimento lavabile in lavatrice, 52x54 cm","192","0","1","FALSE","Fix Me Please My Lord",NA
"120","B07VC16GW8","B07VC16GW8","imetec compact es1 100 bilancia pesapersone elettronica compatta, design ultrasottile, ampio lcd display, portata max 150 kg","124","0","1","FALSE","Fix Me Please My Lord",NA
"121","B07W4JVN8S","B07W4JVN8S","imetec monitoring es9 300 bilancia pesapersone elettronica, monitoraggio trend grafico peso, 4 utenti, fino a 180 kg, lcd display, vetro temperato","146","0","1","FALSE","Fix Me Please My Lord",NA
"122","B09N2JV9X3","B09N2JV9X3","imetec pro, bilancia pesapersone analogica, rileva il peso in modo chiaro e affidabile, pedana antiscivolo, portata max 150 kg, divisione 1 kg, funzionamento meccanico","167","0","1","FALSE","Fix Me Please My Lord",NA
"123","B07WBZC85N","B07WBZC85N","imetec precision es13 200 bilancia pesapersone elettronica, rivela anche le minime variazioni di peso, fino a 180 kg, lcd display, vetro temperato, batterie incluse","164","0","1","FALSE","Fix Me Please My Lord",NA
"124","B07VGH4Z81","B07VGH4Z81","imetec body analizer es7 400 bilancia pesapersone diagnostica, misura acqua corporea, massa muscolare e grassa","110","0","1","FALSE","Fix Me Please My Lord",NA
"125","B00GLSDCS2","B00GLSDCS2","imetec nuvola ferro da stiro da viaggio a vapore, piastra in acciaio inossidabile da 1000 w, custodia da viaggio, doppio voltaggio","130","0","1","FALSE","Fix Me Please My Lord",NA
"126","B07CKY9SNZ","B07CKY9SNZ","imetec zerocalc z1 2500 ferro da stiro, tecnologia anticalcare, piastra inox 2200 w, colpo vapore 120 g","103","0","1","FALSE","Fix Me Please My Lord",NA
"127","B07MZGRDJ4","B07MZGRDJ4","imetec zerocalc z3 3700 ferro da stiro, tecnologia anticalcare, piastra ceramica ad alta scorrevolezza, 2400w, colpo vapore 160 g, 0,3 litri, dispositivo antigoccia tecnologia a risparmio energetico","198","0","1","FALSE","Fix Me Please My Lord",NA
"128","B07NYRRF1Y","B07NYRRF1Y","imetec zerocalc z3 3900 ferro da stiro a vapore, tecnologia anticalcare, tecnologia intellivapor (temperatura unica ideale per tutti i tessuti), piastra ceramica, 2400 w, colpo vapore 170 g","189","0","1","FALSE","Fix Me Please My Lord",NA
"129","B07CKRCMB7","B07CKRCMB7","imetec zerocalc z3 3500 ferro da stiro, tecnologia anticalcare, piastra inox 2400 w, colpo vapore 150 g","103","0","1","FALSE","Fix Me Please My Lord",NA
"130","B08V11MR92","B08V11MR92","imetec eco perfect ferro da stiro a vapore, risultati ottimi con -35% di consumo di acqua e -25% di consumo energetico, piastra con rivestimento pro ceramic, tripla protezione anticalcare, 2400 w","195","0","1","FALSE","Fix Me Please My Lord",NA
"131","B08X6QMR36","B08X6QMR36","imetec onda f1, ferro da stiro a vapore con piastra a onde scorrevole brevettata, 2400 w, colpo di vapore 200g, serbatoio 300 ml, tripla protezione anticalcare","159","0","1","FALSE","Fix Me Please My Lord",NA
"132","B09SDHHKJZ","B09SDHHKJZ","imetec intellifast, ferro da stiro a vapore, tecnologia intelli system, impostazione automatica della temperatura, piastra ceramic diamond, protezione anticalcare, 2400 w, colpo vapore 200 g","190","0","1","FALSE","Fix Me Please My Lord",NA
"133","B0BCPB5TYQ","B0BCPB5TYQ","imetec activation ferro da stiro a vapore, piastra scorrevole in ceramica e tormalina, colpo vapore 200 g, tecnologia anticalcare zerocalc, antigoccia, eco, 2400 w","163","0","1","FALSE","Fix Me Please My Lord",NA
"134","B07S61V42S","B07S61V42S","imetec zerocalc kf1 100 kit 3 filtri anticalcare per ferri da stiro imetec zerocalc pro ceramic ps2 2400, ps2 2000, ps2 2200, intellivapor ps3 3000, imetec onda, ricambi originali","179","0","1","FALSE","Fix Me Please My Lord",NA
"135","B0B1QV8TWC","B0B1QV8TWC","imetec rapidvapor ferro da stiro generatore di vapore, piastra fluid ceramic a rapido riscaldamento, leggero, sistema di pulizia calc clean, colpo vapore 240 g, 2400 w, 5 bar pump","179","0","1","FALSE","Fix Me Please My Lord",NA
"136","B08HS4ZSMH","B08HS4ZSMH","imetec onda f2, ferro da stiro a vapore con piastra a onde scorrevole brevettata, 2400 w, colpo di vapore 200g, serbatoio 300 ml, tripla protezione anticalcare","159","0","1","FALSE","Fix Me Please My Lord",NA
"137","B08HS61FJ5","B08HS61FJ5","imetec onda p2 ferro da stiro generatore di vapore, piastra a onde scorrevole brevettata, 2400w, colpo vapore 300 g, serbatoio 2,5l, 3 filtri con ioni di argento, tecnologia no stop vapor","187","0","1","FALSE","Fix Me Please My Lord",NA
"138","B07PPC54RD","B07PPC54RD","imetec zerocalc z1 2800 ferro da stiro con tecnologia anticalcare, piastra ceramica ad alta scorrevolezza, tecnologia a risparmio energetico, 2200 w, colpo vapore 130 g","168","0","1","FALSE","Fix Me Please My Lord",NA
"139","B07P35DTPJ","B07P35DTPJ","imetec zerocalc ps1 2000 ferro da stiro compatto, 3.8 bar, tecnologia anticalcare e a risparmio energetico, ricarica continua, vapore pronto in 1 minuto, 2100 w, serbatoio xl da 1 l, bianco/blu","193","0","1","FALSE","Fix Me Please My Lord",NA
"140","B0BLCXY3J8","B0BLCXY3J8","imetec adapto elegance, plaid riscaldabile, coperta elettrica, 180x140 cm tessuto morbido, risparmio energetico, tecnologia adapto, rapido riscaldamento, 6 temperature, lavabile","177","0","1","FALSE","Fix Me Please My Lord",NA
"141","B0BLCZ42BG","B0BLCZ42BG","imetec adapto grand luxe, plaid riscaldabile, coperta elettrica, 180x140 cm tessuto morbido, risparmio energetico, tecnologia adapto, rapido riscaldamento, 6 temperature, lavabile","179","0","1","FALSE","Fix Me Please My Lord",NA
