"","asin","asin_2","title_lower","chr_len_dynamic","real_name_norm","real_name_chr_len","is_the_same","need_fix","X..i.."
"1","B08LVXG2V1","B08LVXG2V1","bellissima my pro imetec diffon ceramic, diffusore ad aria calda per capelli ricci, tecnologia ceramica, 700 w, 2 combinazioni aria/temperatura, asciugatura delicata senza effetto crespo","186","0","1","FALSE","Fix Me Please My Lord",NA
"2","B07Y8DPHCL","B07Y8DPHCL","bellissima imetec p3 3400 asciugacapelli con motore ac professionale, tecnologia a ioni per capelli morbidi, idratati e luminosi, griglia rivestita in ceramica, 2400 w di potenza","178","0","1","FALSE","Fix Me Please My Lord",NA
"3","B07FZ4PVRP","B07FZ4PVRP","bellissima my pro imetec steam b28 100 piastra per capelli professionale a vapore, effetto liscio a lungo, ceramica, temperatura regolabile 170°c - 200°c - 230°c, riscaldamento rapido","183","0","1","FALSE","Fix Me Please My Lord",NA
"4","B07FYHM3QY","B07FYHM3QY","bellissima imetec magic straight brush pb11 100 spazzola elettrica lisciante, 3 lati esterni riscaldati, spegnimento automatico, tecnologia a ioni, ceramica, 160 c°- 210°c","171","0","1","FALSE","Fix Me Please My Lord",NA
"5","B07S5L8VYG","B07S5L8VYG","bellissima my pro imetec magic style brush p2 30 spazzola riscaldata, capelli liscio effetto naturale/mosso sostenuto, diametro 30 mm, tecnologia a ioni, rivestimento ceramica","175","0","1","FALSE","Fix Me Please My Lord",NA
"6","B06WGV3DBP","B06WGV3DBP","bellissima my pro imetec beach waves gt20 100 piastra per capelli a onde larghe e strette, rivestimento in ceramica, temperatura regolabile","139","0","1","FALSE","Fix Me Please My Lord",NA
"7","B08NKXBJX1","B08NKXBJX1","bellissima my pro imetec beach waves gt20 400 piastra per capelli per onde larghe e strette, rivestimento in ceramica, temperatura regolabile 160 c°- 200°c","155","0","1","FALSE","Fix Me Please My Lord",NA
"8","B07W3VJQZD","B07W3VJQZD","bellissima my pro imetec gh18 1100 modellatore ad aria, rivestimento spazzole in ceramica, 5 accessori per realizzare capelli lisci e luminosi, a onde morbide o ricci stretti, 1000 w","182","0","1","FALSE","Fix Me Please My Lord",NA
"9","B08J8XH5BH","B08J8XH5BH","bellissima my pro imetec twist & style gt22 100, manico per styler arricciacapelli per onde e ricci, temperatura automatica, riscaldamento rapido, orientabile a 90°, accessori non inclusi","187","0","1","FALSE","Fix Me Please My Lord",NA
"10","B08J8XNFNC","B08J8XNFNC","bellissima my pro imetec gt22 110, accessorio soft curls per styler arricciacapelli twist & style, ferro riscaldato da 25 mm, rivestimento in ceramica, temperatura 185°c","169","0","1","FALSE","Fix Me Please My Lord",NA
"11","B08J8XCSH4","B08J8XCSH4","bellissima my pro imetec gt22 120, accessorio sculpted curls per styler arricciacapelli twist & style, ferro riscaldato da 11 mm, rivestimento in ceramica, temperatura 185°c","173","0","1","FALSE","Fix Me Please My Lord",NA
"12","B08J8XCSHB","B08J8XCSHB","bellissima my pro imetec gt22 130, accessorio loose waves per styler arricciacapelli twist&style, ferro riscaldato ad ellisse, diametro da 26 a 38 mm, rivestimento ceramica, temperatura 190°c","191","0","1","FALSE","Fix Me Please My Lord",NA
"13","B08J8XN21F","B08J8XN21F","bellissima my pro imetec gt22 140 accessorio glamour waves per styler arricciacapelli twist&style, ferro riscaldato forma conica, diametro 13/38 mm, rivestimento in ceramica, temperatura 190°c","192","0","1","FALSE","Fix Me Please My Lord",NA
"14","B09CTZ6WKM","B09CTZ6WKM","bellissima my pro imetec gt22 150 accessorio mermaid waves per styler arricciacapelli twist&style, ferro riscaldato forma bubbles, diametro 25 mm, rivestimento in ceramica, temperatura 190°c","190","0","1","FALSE","Fix Me Please My Lord",NA
"15","B09CTZZGFY","B09CTZZGFY","bellissima my pro imetec gt22 160, accessorio hollywood waves per styler arricciacapelli twist&style, rivestimento in ceramica, temperatura 190°c, ovale, diametro 38 x 25 mm","173","0","1","FALSE","Fix Me Please My Lord",NA
"16","B07JVLQ38M","B07JVLQ38M","bellissima my pro imetec ceramic p5 3800 asciugacapelli professionale per capelli morbidi e luminosi, tecnologia ceramica, 2300 w","129","0","1","FALSE","Fix Me Please My Lord",NA
"17","B082WSYYCX","B082WSYYCX","bellissima imetec asciugacapelli k9 2300 asciuga e mantiene idratati i capelli senza effetto crespo, 2300 w, tecnologia a ioni, 8 combinazioni flusso d'aria temperatura, diffusore capellli ricci","194","0","1","FALSE","Fix Me Please My Lord",NA
"18","B082WSZXHB","B082WSZXHB","bellissima imetec asciugacapelli s9 2200 asciuga e modella con precisione, 2200 w, 8 combinazioni flusso d'aria temperatura, beccussio di precisione, colpo aria fredda","167","0","1","FALSE","Fix Me Please My Lord",NA
"19","B09CTY5P2L","B09CTY5P2L","bellissima imetec creativity 4 you, asciugacapelli professionale, 4 accessori, diffusore, controllo intelligente della temperatura, ion technology, beauty bag, 2 velocità, 3 temperature, 1800 w","193","0","1","FALSE","Fix Me Please My Lord",NA
"20","B09SGB55N4","B09SGB55N4","bellissima imetec diffon supreme, diffusore ad aria calda per capelli ricci, diffusore xl con 12 dita, tecnologia ceramica&argan oil, 2 velocità, 3 temperature, ionizzatore, asciugatura delicata","194","0","1","FALSE","Fix Me Please My Lord",NA
"21","B015O6A6GM","B015O6A6GM","bellissima imetec p11 2300 asciugacapelli professionale, 2300 w, rivestimento in ceramica e tormalina, 8 combinazioni aria/temperatura, beccuccio stretto, diffusore capelli ricci","178","0","1","FALSE","Fix Me Please My Lord",NA
"22","B00G3DNXIE","B00G3DNXIE","bellissima imetec s5 2200 asciugacapelli, 2200 w, asciugatura rapida e styling a lunga durata, 8 combinazioni aria/temperatura, colpo d'aria fredda","147","0","1","FALSE","Fix Me Please My Lord",NA
"23","B07Y8DHN3F","B07Y8DHN3F","imetec eco se9 1000 asciugacapelli con tecnologia eco technology 1400 w, consumo energetico ridotto, 8 combinazioni aria/temperatura, diffusore per capelli ricci","161","0","1","FALSE","Fix Me Please My Lord",NA
"24","B015O6AFPE","B015O6AFPE","imetec c20 2100 asciugacapelli, 2100 w, beccuccio orientabile, diffusore professionale, funzione fast drying per un'asciugatura rapida, 4 combinazioni aria/temperatura, colpo aria fredda, cavo 1.8 m","198","0","1","FALSE","Fix Me Please My Lord",NA
"25","B00O4QVS66","B00O4QVS66","bellissima imetec p2 2200 asciugacapelli professionale, potenza 2200 w, tecnologia a ioni per idratare i capelli e ridurre leffetto crespo, 8 combinazioni aria/temperatura, beccuccio stretto","190","0","1","FALSE","Fix Me Please My Lord",NA
"26","B093C19CSD","B093C19CSD","imetec salon expert p3 3600 asciugacapelli, motore professionale, 2200 w, ionizzatore, griglia ceramica e tormalina, 8 combinazioni aria temperatura, concentratore e diffusore professionali","189","0","1","FALSE","Fix Me Please My Lord",NA
"27","B079Z9GXQS","B079Z9GXQS","imetec salon expert p5 3600 asciugacapelli professionale, 2300 w, griglia con rivestimento in ceramica e cheratina, tecnologia a ioni, 8 combinazioni aria/temperatura, 2 beccucci","178","0","1","FALSE","Fix Me Please My Lord",NA
"28","B09ZJ9QXZY","B09ZJ9QXZY","bellissima imetec creativity ceramic & tourmaline, piastra per capelli, liscio o mosso, rivestimento in ceramica e tormalina, regolazione temperatura da 150-230°c, riscaldamento rapido","184","0","1","FALSE","Fix Me Please My Lord",NA
"29","B07S5L9937","B07S5L9937","bellissima imetec my pro creativity infrared b8 200, piastra lisciante, tecnologia raggi infrarossi, rivestimento in ceramica e cheratina, 11 livelli di temperatura da 130 °c a 230 °c, cavo 1,8 m","195","0","1","FALSE","Fix Me Please My Lord",NA
"30","B072MSQDQG","B072MSQDQG","bellissima imetec b26 100 piastra per capelli lunghi o difficili da disciplinare, formato extra large, rivestimento in ceramica, 160° c - 230° c","144","0","1","FALSE","Fix Me Please My Lord",NA
"31","B00RP0J7AW","B00RP0J7AW","bellissima imetec b9 100 piastra per capelli, piastra extralunghe, riscaldamento rapido, multivoltaggio automatico, temperatura 210°, cavo giravole","147","0","1","FALSE","Fix Me Please My Lord",NA
"32","B00VYLJ4H4","B00VYLJ4H4","bellissima imetec creativity b9 300 piastra per capelli, styling liscio o mosso, rivestimento in ceramica, regolazione temperatura da 150°c a 230°c, sistema riscaldamento rapido","177","0","1","FALSE","Fix Me Please My Lord",NA
"33","B015O6A68K","B015O6A68K","bellissima imetec creativity b9 400 piastra per capelli, styling liscio o mosso, rivestimento in ceramica e cheratina, piastre arrotondate","138","0","1","FALSE","Fix Me Please My Lord",NA
"34","B079FN8N4T","B079FN8N4T","bellissima imetec bm 200 piastra mini per capelli lisci e luminosi, temperatura 200°, multivoltaggio automatico, dimensioni compatte da viaggio","143","0","1","FALSE","Fix Me Please My Lord",NA
"35","B00HLUUNOK","B00HLUUNOK","bellissima imetec creativity b15 50 piastra per capelli, styling liscio o mosso, rivestimento in nanoceramica, regolazione della temperatura da 140°c a 230°c, piastre oscillanti","177","0","1","FALSE","Fix Me Please My Lord",NA
"36","B075RGG4Y5","B075RGG4Y5","bellissima imetec creativity b27 100 piastra per capelli con rivestimento in ceramica e controllo della temperatura, temperatura regolabile 150°c / 230°c","153","0","1","FALSE","Fix Me Please My Lord",NA
"37","B01N55NF5G","B01N55NF5G","bellissima imetec creativity color shine b22 100 piastra per capelli colorati, rivestimento in tessuto per la protezione dei capelli, temperatura regolabile da 150°c a 230°c","173","0","1","FALSE","Fix Me Please My Lord",NA
"38","B06WP9PPT6","B06WP9PPT6","bellissima imetec intellisense b24 100 piastra intelligente, capelli lisci o mossi, protetti senza calore eccessivo, temperatura automatica su misura per tutti i capelli, rivestimento in ceramica","195","0","1","FALSE","Fix Me Please My Lord",NA
"39","B09BJ7LNR6","B09BJ7LNR6","bellissima imetec steam elixir, piastra a vapore, capelli lisci in una sola passata senza danni, rivestimento in ceramica e olio argan, rapido riscaldamento, 4 temperature, tappetino termoresistente","198","0","1","FALSE","Fix Me Please My Lord",NA
"40","B08X7BYVZQ","B08X7BYVZQ","bellissima imetec my pro revolution bhs4 1100, spazzola ad aria calda, asciuga e modella, rotazione automatica a doppio verso, 2 spazzole da 40 e 50 mm, ionizzatore, 1000 w, rivestimento in ceramica","198","0","1","FALSE","Fix Me Please My Lord",NA
"41","B09BHV4DWG","B09BHV4DWG","bellissima imetec air wonder, spazzola ad aria calda, tecnologia a ioni, spazzole rivestite in ceramica e cheratina, asciuga, dona volume, 8 accessori, 1000 w","158","0","1","FALSE","Fix Me Please My Lord",NA
"42","B00N4K5PDK","B00N4K5PDK","bellissima imetec gh16 400 spazzola ad aria modellante con 2 accessori di styling, diametro 25 mm, potenza 400 w, 2 combinazioni flusso d'aria/temperatura, puntale antiscottatura","178","0","1","FALSE","Fix Me Please My Lord",NA
"43","B00SKVYB6K","B00SKVYB6K","bellissima imetec gt13 50 arricciacapelli, rivestimento in ceramica, 7 diversi livelli di temperatura da 150°c a 210°c, diametro di 25 mm, riscaldamento rapido, pronto alluso","174","0","1","FALSE","Fix Me Please My Lord",NA
"44","B075RFR2CV","B075RFR2CV","bellissima imetec gt15 200 ferro arricciacapelli con rivestimento in ceramica, forma conica, controllo della temperatura","120","0","1","FALSE","Fix Me Please My Lord",NA
"45","B00VRGPXF8","B00VRGPXF8","bellissima imetec gt15 100 arricciacapelli, ricci brillanti e definiti, diametro 19 mm, rivestimento in ceramica, riscaldamento rapido, pronto all'uso","150","0","1","FALSE","Fix Me Please My Lord",NA
"46","B0B9HC9HSR","B0B9HC9HSR","bellissima imetec kit bellezza capelli con asciugacapelli professionale, tecnologia ceramica e cheratina e piastra lisciante a vapore, rivestimento in ceramica e cheratina","171","0","1","FALSE","Fix Me Please My Lord",NA
"47","B0BFBDBJK2","B0BFBDBJK2","bellissima diffon ceramic argan, diffusore ad aria calda per capelli ricci, tecnologia ceramica e argan oil, asciugatura delicata, 2 livelli aria/temperatura, 700 w","164","0","1","FALSE","Fix Me Please My Lord",NA
"48","B0BFGMJSV6","B0BFGMJSV6","bellissima twist&style arricciacapelli, manico + 4 accessori per ricci e onde, temperatura automatica, riscaldamento rapido, rivestimento in ceramica, orientabile a 90°, idea regalo","181","0","1","FALSE","Fix Me Please My Lord",NA
"49","B0BFBDBJK2","B0BFBDBJK2","bellissima diffon ceramic argan, diffusore ad aria calda per capelli ricci, tecnologia ceramica e argan oil, asciugatura delicata, 2 livelli aria/temperatura, 700 w","164","0","1","FALSE","Fix Me Please My Lord",NA
"50","B0987B62CP","B0987B62CP","imetec silent power comfort, termoventilatore silenzioso e compatto, stufetta elettrica, 2100 w, 4 funzioni, termostato ambiente e di sicurezza, funzione antigelo, maniglia","172","0","1","FALSE","Fix Me Please My Lord",NA
"51","B0987BTDT2","B0987BTDT2","imetec silent power eco, termoventilatore silenzioso, stufetta elettrica, tecnologia eco -35% consumo energetico, 2100 w, funzione antigelo, temperatura regolabile, 4 funzioni, termostato ambiente","196","0","1","FALSE","Fix Me Please My Lord",NA
"52","B0987C6H2S","B0987C6H2S","imetec silent power pure, termoventilatore silenzioso con ionizzatore e timer di autospegnimento, stufetta elettrica, 2100 w, funzione antigelo, temperatura regolabile, 4 funzioni","179","0","1","FALSE","Fix Me Please My Lord",NA
"53","B0987D9K2X","B0987D9K2X","imetec silent power protection, termoventilatore silenzioso, 2100 w, stufetta elettrica, timer spegnimento programmabile, temperatura regolabile, 4 funzioni, termostato ambiente, funzione antigelo","196","0","1","FALSE","Fix Me Please My Lord",NA
"54","B0987D6J4J","B0987D6J4J","imetec compact air, termoventilatore piccolo e potente, stufetta elettrica, 2000 w, maniglia integrata, temperatura regolabile, funzione antigelo, dispositivo di protezione dai surriscaldamenti","193","0","1","FALSE","Fix Me Please My Lord",NA
"55","B0987C1JFD","B0987C1JFD","imetec eco ceramic, termoventilatore, stufetta elettrica, tecnologia ceramica, basso consumo energetico, silenzioso, 3 livelli di temperatura, termostato ambiente","162","0","1","FALSE","Fix Me Please My Lord",NA
"56","B0987CNV93","B0987CNV93","imetec eco rapid, stufa elettrica 2000 w, tecnologia a basso consumo energetico, termoconvettore 4 temperature, termostato ambiente, silenzioso","143","0","1","FALSE","Fix Me Please My Lord",NA
"57","B0987BBB14","B0987BBB14","imetec eco ceramic diffusion, stufetta elettrica, termoventilatore, corpo oscillante, tecnologia ceramica, basso consumo energetico, 6 funzioni di temperatura, timer","165","0","1","FALSE","Fix Me Please My Lord",NA
"58","B00FM266R2","B00FM266R2","imetec dolcevita es4 bilancia elettronica da cucina, pesa solidi e liquidi, contenitore estraibile, scala graduata, portata 5 kg, divisione 1 g, funzione tara, display digitale, spegnimento automatico","200","0","1","FALSE","Fix Me Please My Lord",NA
"59","B076998CD8","B076998CD8","imetec succovivo pro 2000 estrattore di succo professionale a freddo, spremitura lenta 48 giri/min, 2 filtri per succhi, accessorio per granite e sorbetti, kit per maschere bellezza, con ricettario","197","0","1","FALSE","Fix Me Please My Lord",NA
"60","B08JVC7VB4","B08JVC7VB4","imetec crea&crema sbattitore elettrico, fruste extralunghe per impasti dolci e panna montata, ganci acciaio inox per impastare, 5 velocità, funzione turbo, design ergonomico, 500 w","180","0","1","FALSE","Fix Me Please My Lord",NA
"61","B08R7NM2SF","B08R7NM2SF","imetec tosta&griglia, tostiera elettrica, piastre xl per preparare 3 toast alla volta, compatta, riponibile in verticale, 800 w, spie di funzionamento","150","0","1","FALSE","Fix Me Please My Lord",NA
"62","B08JV8L49M","B08JV8L49M","imetec tostamaxi tostapane, 2 fessure extralarge e pinze apribili per toast extrafarciti, 10 livelli di doratura, timer con autospegnimento, cassetto raccoglibriciole, 600 w","173","0","1","FALSE","Fix Me Please My Lord",NA
"63","B08R7NSVL5","B08R7NSVL5","imetec grantoast, tostapane per toast extra farciti, fessure xl, pinze a fondo chiuso apribili a 360° e regolabili in larghezza, 600 w, 10 livelli doratura, timer","162","0","1","FALSE","Fix Me Please My Lord",NA
"64","B08NPR8QNN","B08NPR8QNN","imetec tritacompact tritatutto, lame in acciaio inox, capienza contenitore 400 ml, funzionamento a pressione, compatto, 350 w","125","0","1","FALSE","Fix Me Please My Lord",NA
"65","B08NPMMFWQ","B08NPMMFWQ","imetec tritapiù tritatutto, 4 lame in acciaio inox, capiente contenitore 600 ml, 18.000 giri/min, funzionamento a pressione, 1000 w, materiali bpa free","151","0","1","FALSE","Fix Me Please My Lord",NA
"66","B0BDVBHWWD","B0BDVBHWWD","imetec cakelover, impastatrice planetaria per dolci, creme e impasti salati, accessoriata, compatta, 1500w, fruste, pale e ganci, contenitore inox, 5 litri, 6 velocità, ricettario","179","0","1","FALSE","Fix Me Please My Lord",NA
"67","B08JV8FFYH","B08JV8FFYH","imetec griglia&gusta bistecchiera, piastre antiaderenti removibili, rivestimento triplo strato al titanio stone-look, grill con 7 posizioni, 3 funzioni di cottura, thermo control, 2000 watt","189","0","1","FALSE","Fix Me Please My Lord",NA
"68","B08JV87TZW","B08JV87TZW","imetec succovivo sj4 1300 estrattore di succo professionale a freddo, spremitura lenta 50 giri/min, filtro per succhi, accessorio per granite e sorbetti, pulizia in 2 minuti","173","0","1","FALSE","Fix Me Please My Lord",NA
"69","B09K7ZS81N","B09K7ZS81N","imetec friggileggero - friggitrice ad aria multifunzione, 12 programmi, riscaldamento rapido, 18 l, 1550 w, comandi digitali, cestello, griglia, leccarda, ricettario, 40x36x34,5 cm","180","0","1","FALSE","Fix Me Please My Lord",NA
"70","B01JOL22Y2","B01JOL22Y2","imetec hb3 frullatore a immersione, gambo large estraibile, lame in acciaio inox, funzionamento a impulsi, 450 w","112","0","1","FALSE","Fix Me Please My Lord",NA
"71","B08NK25BLP","B08NK25BLP","imetec frulla&crea frullatore a immersione, 3 accessori, tritatutto, frusta e bicchiere bpa free, piede large, 2 velocità, 1000 w, 15000 giri minuto","148","0","1","FALSE","Fix Me Please My Lord",NA
"72","B08NPF5HWD","B08NPF5HWD","imetec frulla&trita frullatore a immersione, lame in acciaio inox, piede extra large, gambo estraibile, bicchiere graduato da 1 litro, 800 watt, 15.000 giri minuto","163","0","1","FALSE","Fix Me Please My Lord",NA
"73","B08NPR9BYM","B08NPR9BYM","imetec frullarapido, frullatore a immersione, gambo xl in acciaio, lame in acciaio inox, funzionamento a impulsi, 450 w","119","0","1","FALSE","Fix Me Please My Lord",NA
"74","B09CYM6KR3","B09CYM6KR3","imetec frullarapido+, frullatore a immersione, gambo xl in acciaio, lame in acciaio inox, funzionamento a impulsi, bicchiere graduato da 700 ml bpa free, 800 w","159","0","1","FALSE","Fix Me Please My Lord",NA
"75","B09CYDKRZ6","B09CYDKRZ6","imetec frullafacile, frullatore a immersione, gambo xl, lame in acciaio inox, funzionamento a impulsi, bicchiere graduato da 700 ml bpa free, 800 w, impugnatura ergonomica","171","0","1","FALSE","Fix Me Please My Lord",NA
"76","B0711KBY99","B0711KBY99","imetec personal e sport blender pb 100 mini frullatore con 2 bottiglie take-away in tritan e 4 lame in acciaio inox, 22,000 giri/min","132","0","1","FALSE","Fix Me Please My Lord",NA
"77","B071451JHC","B071451JHC","imetec sm 1000 soup maker, cuoce e frulla, 3 programmi automatici, vellutate, zuppe e frullati, 6 porzioni, lame seghettate acciaio inox, con ricettario, 900 w, 1.6 litri","170","0","1","FALSE","Fix Me Please My Lord",NA
"78","B08JVCHZF3","B08JVCHZF3","imetec frullatutto frullatore, lame tritaghiaccio in acciaio inox, bicchiere da 800 ml in vetro antigraffio, 2 velocità, funzionamento impulsi, 500 w, 2 velocità, lavabile lavastoviglie","185","0","1","FALSE","Fix Me Please My Lord",NA
"79","B08NPG5D5Y","B08NPG5D5Y","imetec buonfrullato, frullatore compatto, bicchiere in plastica bpa free, capacità 700 ml, coperchio dosa liquidi, 400 w","120","0","1","FALSE","Fix Me Please My Lord",NA
"80","B08RYGFL21","B08RYGFL21","imetec frulla&gusta, frullatore con 4 lame in acciaio inox, bicchiare in vetro, 2 velocità e funzionamento impulsi, 500 w, capienza 800 ml, lavabile lavastoviglie, piedini antiscivolo","183","0","1","FALSE","Fix Me Please My Lord",NA
"81","B08JV9VVQT","B08JV9VVQT","imetec la grattugia, grattugia elettrica, rullo in acciaio inox, tramoggia in alluminio, contenitore estraibile con coperchio salvafreschezza, sistema di sicurezza, 150 w","170","0","1","FALSE","Fix Me Please My Lord",NA
"82","B08XBZV29G","B08XBZV29G","imetec grattugissima, grattuggia elettrica per formaggio, pane e frutta secca, contenitore estraibile, coperchio salvafreschezza, 150 w, rullo in acciacio, accessori lavabili in lavastoviglie","191","0","1","FALSE","Fix Me Please My Lord",NA
"83","B01LXNKQOL","B01LXNKQOL","imetec panemio macchina del pane, impasta lievita e cuoce, 12 programmi, cestello pagnotta, accessorio panini, 3 livelli di doratura, avvio programmabile, 550 w, ricettario","172","0","1","FALSE","Fix Me Please My Lord",NA
"84","B0848JZ6KP","B0848JZ6KP","imetec zero-glu pro, macchina per pane, ciabatte e panini senza glutine per celiaci, pasta pizza, dolci, marmellate, 20 programmi, 2 pale impastatrici, temperatura levitazione controllata, ricettario","199","0","1","FALSE","Fix Me Please My Lord",NA
"85","B08JV7QK54","B08JV7QK54","imetec la panetteria +zeroglu, macchina per pane, ciabatte, panini, dolci con farine naturali e senza glutine, 20 programmi, 2 pale impastatrici, temperatura di lievitazione controllata","185","0","1","FALSE","Fix Me Please My Lord",NA
"86","B08HS77R9B","B08HS77R9B","imetec cukò maestro, robot da cucina con cottura, 20 programmi, 10 funzioni, impasta pane e pizza, capienza 2 l, fino a 6 porzioni, 8 accessori, ricettario, 1000 w","163","0","1","FALSE","Fix Me Please My Lord",NA
"87","B08JV9LX42","B08JV9LX42","imetec la tostagriglia, tostiera, piastre xl rigate e antiaderenti, interruttore on/off, spia riscaldamento piastre, gancio chiusura, avvolgicavo, tostapane compatto, 900 w","172","0","1","FALSE","Fix Me Please My Lord",NA
"88","B0755CJFPL","B0755CJFPL","imetec sp 100 spiralizer elettrico, tagliaverdure a spirale, affetta verdure in 3 forme spaghetti, tagliatelle, pappardelle, lame in acciaio inox, contenitore bpa free 500 ml, sistema di sicurezza","196","0","1","FALSE","Fix Me Please My Lord",NA
"89","B08NK1L69Z","B08NK1L69Z","imetec tritamax, tritatutto, 4 lame in acciaio inox, capiente contenitore 600 ml, accessorio frusta per salse e panna montata, 2 velocità, 500 watt","147","0","1","FALSE","Fix Me Please My Lord",NA
"90","B08NP5M6D4","B08NP5M6D4","imetec frescoaroma macina caffè e spezie, pepe, zucchero, frutta secca elettrico con lame in acciaio inox, contenitore salva-freschezza, funzionamento a impulsi, 150 w","167","0","1","FALSE","Fix Me Please My Lord",NA
"91","B00IRAFHB2","B00IRAFHB2","bellissima imetec kit testine di ricambio face cleansing per pelli normali e pelli sensibili, 4 diverse testine per detergere, massaggiare, levigare e idratare la pelle","168","0","1","FALSE","Fix Me Please My Lord",NA
"92","B009E7CBIY","B009E7CBIY","bellissima imetec face cleansing spazzola per pulizia viso, deterge ed esfolia la pelle del viso","96","0","1","FALSE","Fix Me Please My Lord",NA
"93","B00M975Z7K","B00M975Z7K","imetec scaldasonno sensitive singolo, si adatta ai cambi di temperatura, morbido peluche, coprimaterasso maxi 190 x 90, electro block, 6 temperature, timer, risparmio energetico, lavabile","187","0","1","FALSE","Fix Me Please My Lord",NA
"94","B08J8Z15M1","B08J8Z15M1","imetec adapto velvet square plaid riscaldabile, coperta elettrica 150x95 cm tessuto morbido, basso consumo, tecnologia adapto, dispositivo di sicurezza, rapido riscaldamento, 6 temperature, lavabile","198","0","1","FALSE","Fix Me Please My Lord",NA
"95","B08J8ZLLDT","B08J8ZLLDT","imetec adapto velvet jacquard plaid riscaldabile, coperta elettrica 140x180 cm tessuto morbido, basso consumo, tecnologia adapto, sicuro, rapido riscaldamento, 6 temperature, lavabile","183","0","1","FALSE","Fix Me Please My Lord",NA
"96","B08J8ZH957","B08J8ZH957","imetec adapto velvet tartan plaid riscaldabile con tasca mani e piedi, coperta elettrica 150x110 cm, basso consumo, tecnologia adapto, sicuro, rapido riscaldamento, 6 temperature, lavabile","188","0","1","FALSE","Fix Me Please My Lord",NA
"97","B08J8XJHNM","B08J8XJHNM","imetec adapto velvet tartan plaid riscaldabile, coperta elettrica 160x120 cm tessuto morbido, basso consumo, tecnologia adapto, dispositivo di sicurezza, rapido riscaldamento, 6 temperature, lavabile","199","0","1","FALSE","Fix Me Please My Lord",NA
"98","B00A9269R2","B00A9269R2","imetec scaldasonno matrimoniale, 150 x 140 cm, 2 comandi con 2 temperature, tessuto trapuntato, lavabile a mano e in lavatrice a 40°c","133","0","1","FALSE","Fix Me Please My Lord",NA
"99","B00K6MR6JK","B00K6MR6JK","imetec scaldasonno matrimoniale, 150 x 140 cm, 2 comandi con 2 temperature, tessuto trapuntato, lavabile a mano e in lavatrice a 40°c","133","0","1","FALSE","Fix Me Please My Lord",NA
"100","B07Y8GR1WS","B07Y8GR1WS","imetec scaldasonno adapto singolo 150 x 80 cm, basso consumo, tecnologia brevettata, riscaldamento rapido, temperatura personalizzata, 100% cotone, made in italy, comando con 6 temperature","188","0","1","FALSE","Fix Me Please My Lord",NA
"101","B07Y8GH4K8","B07Y8GH4K8","imetec scaldasonno adapto matrimoniale 150 x 160 cm, basso consumo, tecnologia brevettata, riscaldamento rapido, temperatura personalizzata, 100% cotone, made in italy, 2 comandi con 6 temperature","196","0","1","FALSE","Fix Me Please My Lord",NA
