"127","B09SDHHKJZ","B09SDHHKJZ",TRUE,"imetec intellifast, ferro da stiro a vapore, tecnologia intelli system, impostazione automatica della temperatura, piastra ceramic diamond, protezione anticalcare, 2400 w, colpo vapore 200 g","imetec intellifast, ferro da stiro a vapore, tecnologia intelli system, impostazione automatica della temperatura, piastra ceramic diamond, protezione anticalcare, 2400 w, colpo vapore 200 g",TRUE,190,190,TRUE,"TRUE"
"128","B09SGB55N4","B09SGB55N4",TRUE,"bellissima imetec diffon supreme, diffusore ad aria calda per capelli ricci, diffusore xl con 12 dita, tecnologia ceramica&argan oil, 2 velocità, 3 temperature, ionizzatore, asciugatura delicata","bellissima imetec diffon supreme, diffusore ad aria calda per capelli ricci, diffusore xl con 12 dita, tecnologia ceramica&argan oil, 2 velocità, 3 temperature, ionizzatore, asciugatura delicata",TRUE,194,194,TRUE,"TRUE"
"129","B09ZJ9QXZY","B09ZJ9QXZY",TRUE,"bellissima imetec creativity ceramic & tourmaline, piastra per capelli, liscio o mosso, rivestimento in ceramica e tormalina, regolazione temperatura da 150-230°c, riscaldamento rapido","bellissima imetec creativity ceramic & tourmaline, piastra per capelli, liscio o mosso, rivestimento in ceramica e tormalina, regolazione temperatura da 150-230°c, riscaldamento rapido",TRUE,184,184,TRUE,"TRUE"
"130","B0B1QV8TWC","B0B1QV8TWC",TRUE,"imetec rapidvapor ferro da stiro generatore di vapore, piastra fluid ceramic a rapido riscaldamento, leggero, sistema di pulizia calc clean, colpo vapore 240 g, 2400 w, 5 bar pump","imetec rapidvapor ferro da stiro generatore di vapore, piastra fluid ceramic a rapido riscaldamento, leggero, sistema di pulizia calc clean, colpo vapore 240 g, 2400 w, 5 bar pump",TRUE,179,179,TRUE,"TRUE"
"131","B0B8JFYZ34","B0B8JFYZ34",TRUE,"imetec intellisensefeet, scaldapiedi tecnologia intellisense, tessuto morbido, 5 temperature, autospegnimento, dispositivo sicurezza electro block, rivestimento lavabile in lavatrice, 52x54 cm","imetec intellisensefeet, scaldapiedi tecnologia intellisense, tessuto morbido, 5 temperature, autospegnimento, dispositivo sicurezza electro block, rivestimento lavabile in lavatrice, 52x54 cm",TRUE,192,192,TRUE,"TRUE"
"132","B0B9HC9HSR","B0B9HC9HSR",TRUE,"bellissima imetec kit bellezza capelli con asciugacapelli professionale, tecnologia ceramica e cheratina e piastra lisciante a vapore, rivestimento in ceramica e cheratina","bellissima imetec kit bellezza capelli con asciugacapelli professionale, tecnologia ceramica e cheratina e piastra lisciante a vapore, rivestimento in ceramica e cheratina",TRUE,171,171,TRUE,"TRUE"
"133","B0BCPB5TYQ","B0BCPB5TYQ",TRUE,"imetec activation ferro da stiro a vapore, piastra scorrevole in ceramica e tormalina, colpo vapore 200 g, tecnologia anticalcare zerocalc, antigoccia, eco, 2400 w","imetec activation ferro da stiro a vapore, piastra scorrevole in ceramica e tormalina, colpo vapore 200 g, tecnologia anticalcare zerocalc, antigoccia, eco, 2400 w",TRUE,163,163,TRUE,"TRUE"
"134","B0BDVBHWWD","B0BDVBHWWD",TRUE,"imetec cakelover, impastatrice planetaria per dolci, creme e impasti salati, accessoriata, compatta, 1500w, fruste, pale e ganci, contenitore inox, 5 litri, 6 velocità, ricettario","imetec cakelover, impastatrice planetaria per dolci, creme e impasti salati, accessoriata, compatta, 1500w, fruste, pale e ganci, contenitore inox, 5 litri, 6 velocità, ricettario",TRUE,179,179,TRUE,"TRUE"
"135","B0BFBDBJK2","B0BFBDBJK2",TRUE,"bellissima imetec diffon ceramic argan, diffusore ad aria calda per capelli ricci, tecnologia ceramica e argan oil, asciugatura delicata, 2 livelli aria/temperatura, 700 w","bellissima imetec diffon ceramic argan, diffusore ad aria calda per capelli ricci, tecnologia ceramica e argan oil, asciugatura delicata, 2 livelli aria/temperatura, 700 w",TRUE,171,171,TRUE,"TRUE"
"136","B0BFBDBJK2","B0BFBDBJK2",TRUE,"bellissima imetec diffon ceramic argan, diffusore ad aria calda per capelli ricci, tecnologia ceramica e argan oil, asciugatura delicata, 2 livelli aria/temperatura, 700 w","bellissima imetec diffon ceramic argan, diffusore ad aria calda per capelli ricci, tecnologia ceramica e argan oil, asciugatura delicata, 2 livelli aria/temperatura, 700 w",TRUE,171,171,TRUE,"TRUE"
"137","B0BFBDBJK2","B0BFBDBJK2",TRUE,"bellissima imetec diffon ceramic argan, diffusore ad aria calda per capelli ricci, tecnologia ceramica e argan oil, asciugatura delicata, 2 livelli aria/temperatura, 700 w","bellissima imetec diffon ceramic argan, diffusore ad aria calda per capelli ricci, tecnologia ceramica e argan oil, asciugatura delicata, 2 livelli aria/temperatura, 700 w",TRUE,171,171,TRUE,"TRUE"
"138","B0BFBDBJK2","B0BFBDBJK2",TRUE,"bellissima imetec diffon ceramic argan, diffusore ad aria calda per capelli ricci, tecnologia ceramica e argan oil, asciugatura delicata, 2 livelli aria/temperatura, 700 w","bellissima imetec diffon ceramic argan, diffusore ad aria calda per capelli ricci, tecnologia ceramica e argan oil, asciugatura delicata, 2 livelli aria/temperatura, 700 w",TRUE,171,171,TRUE,"TRUE"
"139","B0BFGMJSV6","B0BFGMJSV6",TRUE,"bellissima twist&style arricciacapelli, manico + 4 accessori per ricci e onde, temperatura automatica, riscaldamento rapido, rivestimento in ceramica, orientabile a 90°, idea regalo","bellissima twist&style arricciacapelli, manico + 4 accessori per ricci e onde, temperatura automatica, riscaldamento rapido, rivestimento in ceramica, orientabile a 90°, idea regalo",TRUE,181,181,TRUE,"TRUE"
