"65","B08HR23S41","B08HR23S41",TRUE,"imetec scaldasonno adapto maxi coprimaterasso matrimoniale 195x165 cm, basso consumo, riscaldamento rapido, temperatura personalizzata, tessuto anallergico trapuntato, doppio comando, 6 temperature","imetec scaldasonno adapto maxi coprimaterasso matrimoniale 195x165 cm, basso consumo, riscaldamento rapido, temperatura personalizzata, tessuto anallergico trapuntato, doppio comando, 6 temperature",TRUE,197,197,TRUE,"TRUE"
"66","B08HS4ZSMH","B08HS4ZSMH",TRUE,"imetec onda f2, ferro da stiro a vapore con piastra a onde scorrevole brevettata, 2400 w, colpo di vapore 200g, serbatoio 300 ml, tripla protezione anticalcare","imetec onda f2, ferro da stiro a vapore con piastra a onde scorrevole brevettata, 2400 w, colpo di vapore 200g, serbatoio 300 ml, tripla protezione anticalcare",TRUE,159,159,TRUE,"TRUE"
"67","B08HS61FJ5","B08HS61FJ5",TRUE,"imetec onda p2 ferro da stiro generatore di vapore, piastra a onde scorrevole brevettata, 2400w, colpo vapore 300 g, serbatoio 2,5l, 3 filtri con ioni di argento, tecnologia no stop vapor","imetec onda p2 ferro da stiro generatore di vapore, piastra a onde scorrevole brevettata, 2400w, colpo vapore 300 g, serbatoio 2,5l, 3 filtri con ioni di argento, tecnologia no stop vapor",TRUE,187,187,TRUE,"TRUE"
"68","B08HS77R9B","B08HS77R9B",TRUE,"imetec cukò maestro, robot da cucina con cottura, 20 programmi, 10 funzioni, impasta pane e pizza, capienza 2 l, fino a 6 porzioni, 8 accessori, ricettario, 1000 w","imetec cukò maestro, robot da cucina con cottura, 20 programmi, 10 funzioni, impasta pane e pizza, capienza 2 l, fino a 6 porzioni, 8 accessori, ricettario, 1000 w",TRUE,163,163,TRUE,"TRUE"
"69","B08J8XCSH4","B08J8XCSH4",TRUE,"bellissima imetec gt22 120, accessorio sculpted curls per styler arricciacapelli twist & style, ferro riscaldato da 11 mm, rivestimento in ceramica, temperatura 185°c","bellissima imetec gt22 120, accessorio sculpted curls per styler arricciacapelli twist & style, ferro riscaldato da 11 mm, rivestimento in ceramica, temperatura 185°c",TRUE,166,166,TRUE,"TRUE"
"70","B08J8XCSHB","B08J8XCSHB",TRUE,"bellissima imetec gt22 130, accessorio loose waves per styler arricciacapelli twist&style, ferro riscaldato ad ellisse, diametro da 26 a 38 mm, rivestimento ceramica, temperatura 190°c","bellissima imetec gt22 130, accessorio loose waves per styler arricciacapelli twist&style, ferro riscaldato ad ellisse, diametro da 26 a 38 mm, rivestimento ceramica, temperatura 190°c",TRUE,184,184,TRUE,"TRUE"
"71","B08J8XH5BH","B08J8XH5BH",TRUE,"bellissima imetec twist & style gt22 100, manico per styler arricciacapelli per onde e ricci, temperatura automatica, riscaldamento rapido, orientabile a 90°, accessori non inclusi","bellissima imetec twist & style gt22 100, manico per styler arricciacapelli per onde e ricci, temperatura automatica, riscaldamento rapido, orientabile a 90°, accessori non inclusi",TRUE,180,180,TRUE,"TRUE"
"72","B08J8XJHNM","B08J8XJHNM",TRUE,"imetec adapto velvet tartan plaid riscaldabile, coperta elettrica 160x120 cm tessuto morbido, basso consumo, tecnologia adapto, sicuro, rapido riscaldamento, 6 temperature, lavabile","imetec adapto velvet tartan plaid riscaldabile, coperta elettrica 160x120 cm tessuto morbido, basso consumo, tecnologia adapto, sicuro, rapido riscaldamento, 6 temperature, lavabile",TRUE,181,181,TRUE,"TRUE"
"73","B08J8XMFQN","B08J8XMFQN",TRUE,"imetec scaldasonno adapto maxi coprimaterasso matrimoniale 195 x 165 cm, basso consumo, riscaldamento rapido, temperatura personalizzata, 100% lana e merino, doppio comando, 6 temperature","imetec scaldasonno adapto maxi coprimaterasso matrimoniale 195 x 165 cm, basso consumo, riscaldamento rapido, temperatura personalizzata, 100% lana e merino, doppio comando, 6 temperature",TRUE,187,187,TRUE,"TRUE"
"74","B08J8XN21F","B08J8XN21F",TRUE,"bellissima imetec gt22 140 accessorio glamour waves per styler arricciacapelli twist&style, ferro riscaldato forma conica, diametro 13/38 mm, rivestimento in ceramica, temperatura 190°c","bellissima imetec gt22 140 accessorio glamour waves per styler arricciacapelli twist&style, ferro riscaldato forma conica, diametro 13/38 mm, rivestimento in ceramica, temperatura 190°c",TRUE,185,185,TRUE,"TRUE"
"75","B08J8XNFNC","B08J8XNFNC",TRUE,"bellissima imetec gt22 110, accessorio soft curls per styler arricciacapelli twist & style, ferro riscaldato da 25 mm, rivestimento in ceramica, temperatura 185°c","bellissima imetec gt22 110, accessorio soft curls per styler arricciacapelli twist & style, ferro riscaldato da 25 mm, rivestimento in ceramica, temperatura 185°c",TRUE,162,162,TRUE,"TRUE"
"76","B08J8Z15M1","B08J8Z15M1",TRUE,"imetec adapto velvet square plaid riscaldabile, coperta elettrica 150x95 cm tessuto morbido, basso consumo, tecnologia adapto, sicuro, rapido riscaldamento, 6 temperature, lavabile","imetec adapto velvet square plaid riscaldabile, coperta elettrica 150x95 cm tessuto morbido, basso consumo, tecnologia adapto, sicuro, rapido riscaldamento, 6 temperature, lavabile",TRUE,180,180,TRUE,"TRUE"
"77","B08J8ZH957","B08J8ZH957",TRUE,"imetec adapto velvet tartan plaid riscaldabile con tasca mani e piedi, coperta elettrica 150x110 cm, basso consumo, tecnologia adapto, sicuro, rapido riscaldamento, 6 temperature, lavabile","imetec adapto velvet tartan plaid riscaldabile con tasca mani e piedi, coperta elettrica 150x110 cm, basso consumo, tecnologia adapto, sicuro, rapido riscaldamento, 6 temperature, lavabile",TRUE,188,188,TRUE,"TRUE"
"78","B08J8ZLLDT","B08J8ZLLDT",TRUE,"imetec adapto velvet jacquard plaid riscaldabile, coperta elettrica 140x180 cm tessuto morbido, basso consumo, tecnologia adapto, sicuro, rapido riscaldamento, 6 temperature, lavabile","imetec adapto velvet jacquard plaid riscaldabile, coperta elettrica 140x180 cm tessuto morbido, basso consumo, tecnologia adapto, sicuro, rapido riscaldamento, 6 temperature, lavabile",TRUE,183,183,TRUE,"TRUE"
"79","B08JV7QK54","B08JV7QK54",TRUE,"imetec la panetteria +zeroglu, macchina per pane, ciabatte, panini, dolci con farine naturali e senza glutine, 20 programmi, 2 pale impastatrici, temperatura di lievitazione controllata, marrone","imetec la panetteria +zeroglu, macchina per pane, ciabatte, panini, dolci con farine naturali e senza glutine, 20 programmi, 2 pale impastatrici, temperatura di lievitazione controllata, marrone",TRUE,194,194,TRUE,"TRUE"
"80","B08JV87TZW","B08JV87TZW",TRUE,"imetec succovivo sj4 1300 estrattore di succo professionale a freddo, spremitura lenta 50 giri/min, filtro per succhi, accessorio per granite e sorbetti, pulizia in 2 minuti","imetec succovivo sj4 1300 estrattore di succo professionale a freddo, spremitura lenta 50 giri/min, filtro per succhi, accessorio per granite e sorbetti, pulizia in 2 minuti",TRUE,173,173,TRUE,"TRUE"
"81","B08JV8FFYH","B08JV8FFYH",TRUE,"imetec griglia&gusta bistecchiera, piastre antiaderenti removibili, rivestimento triplo strato al titanio stone-look, grill con 7 posizioni, 3 funzioni di cottura, thermo control, 2000 watt","imetec griglia&gusta bistecchiera, piastre antiaderenti removibili, rivestimento triplo strato al titanio stone-look, grill con 7 posizioni, 3 funzioni di cottura, thermo control, 2000 watt",TRUE,189,189,TRUE,"TRUE"
"82","B08JV8L49M","B08JV8L49M",TRUE,"imetec tostamaxi tostapane, 2 fessure extralarge e pinze apribili per toast extrafarciti, 10 livelli di doratura, timer con autospegnimento, cassetto raccoglibriciole, 600 w","imetec tostamaxi tostapane, 2 fessure extralarge e pinze apribili per toast extrafarciti, 10 livelli di doratura, timer con autospegnimento, cassetto raccoglibriciole, 600 w",TRUE,173,173,TRUE,"TRUE"
"83","B08JV9LX42","B08JV9LX42",TRUE,"imetec la tostagriglia, tostiera, piastre xl rigate e antiaderenti, interruttore on/off, spia riscaldamento piastre, gancio chiusura, avvolgicavo, tostapane compatto, 900 w","imetec la tostagriglia, tostiera, piastre xl rigate e antiaderenti, interruttore on/off, spia riscaldamento piastre, gancio chiusura, avvolgicavo, tostapane compatto, 900 w",TRUE,172,172,TRUE,"TRUE"
"84","B08JV9VVQT","B08JV9VVQT",TRUE,"imetec la grattugia, grattugia elettrica, rullo in acciaio inox, tramoggia in alluminio, contenitore estraibile con coperchio salvafreschezza, sistema di sicurezza, 150 w","imetec la grattugia, grattugia elettrica, rullo in acciaio inox, tramoggia in alluminio, contenitore estraibile con coperchio salvafreschezza, sistema di sicurezza, 150 w",TRUE,170,170,TRUE,"TRUE"
"85","B08JVC7VB4","B08JVC7VB4",TRUE,"imetec crea&crema sbattitore elettrico, fruste extralunghe per impasti dolci e panna montata, ganci acciaio inox per impastare, 5 velocità, funzione turbo, design ergonomico, 500 w","imetec crea&crema sbattitore elettrico, fruste extralunghe per impasti dolci e panna montata, ganci acciaio inox per impastare, 5 velocità, funzione turbo, design ergonomico, 500 w",TRUE,180,180,TRUE,"TRUE"
"86","B08JVCHZF3","B08JVCHZF3",TRUE,"imetec frullatutto frullatore, lame tritaghiaccio in acciaio inox, bicchiere da 800 ml in vetro antigraffio, 2 velocità, funzionamento impulsi, 500 w, 2 velocità, lavabile lavastoviglie","imetec frullatutto frullatore, lame tritaghiaccio in acciaio inox, bicchiere da 800 ml in vetro antigraffio, 2 velocità, funzionamento impulsi, 500 w, 2 velocità, lavabile lavastoviglie",TRUE,185,185,TRUE,"TRUE"
"87","B08LVXG2V1","B08LVXG2V1",TRUE,"bellissima imetec diffon ceramic, diffusore ad aria calda per capelli ricci, tecnologia ceramica, 700 w, 2 combinazioni aria/temperatura, asciugatura delicata senza effetto crespo","bellissima imetec diffon ceramic, diffusore ad aria calda per capelli ricci, tecnologia ceramica, 700 w, 2 combinazioni aria/temperatura, asciugatura delicata senza effetto crespo",TRUE,179,179,TRUE,"TRUE"
"88","B08NK1L69Z","B08NK1L69Z",TRUE,"imetec tritamax, tritatutto, 4 lame in acciaio inox, capiente contenitore 600 ml, accessorio frusta per salse e panna montata, 2 velocità, 500 watt","imetec tritamax, tritatutto, 4 lame in acciaio inox, capiente contenitore 600 ml, accessorio frusta per salse e panna montata, 2 velocità, 500 watt",TRUE,147,147,TRUE,"TRUE"
"89","B08NK25BLP","B08NK25BLP",TRUE,"imetec frulla&crea frullatore a immersione, 3 accessori, tritatutto, frusta e bicchiere bpa free, piede large, 2 velocità, 1000 w, 15000 giri minuto","imetec frulla&crea frullatore a immersione, 3 accessori, tritatutto, frusta e bicchiere bpa free, piede large, 2 velocità, 1000 w, 15000 giri minuto",TRUE,148,148,TRUE,"TRUE"
"90","B08NKXBJX1","B08NKXBJX1",TRUE,"bellissima imetec beach waves gt20 400 piastra per capelli per onde larghe e strette, rivestimento in ceramica, temperatura regolabile 160° c- 200° c","bellissima imetec beach waves gt20 400 piastra per capelli per onde larghe e strette, rivestimento in ceramica, temperatura regolabile 160° c- 200° c",TRUE,149,149,TRUE,"TRUE"
"91","B08NP5M6D4","B08NP5M6D4",TRUE,"imetec frescoaroma macina caffè e spezie, pepe, zucchero, frutta secca elettrico con lame in acciaio inox, contenitore salva-freschezza, funzionamento a impulsi, 150 w","imetec frescoaroma macina caffè e spezie, pepe, zucchero, frutta secca elettrico con lame in acciaio inox, contenitore salva-freschezza, funzionamento a impulsi, 150 w",TRUE,167,167,TRUE,"TRUE"
"92","B08NPF5HWD","B08NPF5HWD",TRUE,"imetec frulla&trita frullatore a immersione, lame in acciaio inox, piede extra large, gambo estraibile, bicchiere graduato da 1 litro, 800 watt, 15.000 giri minuto","imetec frulla&trita frullatore a immersione, lame in acciaio inox, piede extra large, gambo estraibile, bicchiere graduato da 1 litro, 800 watt, 15.000 giri minuto",TRUE,163,163,TRUE,"TRUE"
"93","B08NPG5D5Y","B08NPG5D5Y",TRUE,"imetec buonfrullato, frullatore compatto, bicchiere in plastica bpa free, capacità 700 ml, coperchio dosa liquidi, 400 w","imetec buonfrullato, frullatore compatto, bicchiere in plastica bpa free, capacità 700 ml, coperchio dosa liquidi, 400 w",TRUE,120,120,TRUE,"TRUE"
"94","B08NPMMFWQ","B08NPMMFWQ",TRUE,"imetec tritapiù tritatutto, 4 lame in acciaio inox, capiente contenitore 600 ml, 18.000 giri/min, funzionamento a pressione, 1000 w, materiali bpa free, bianco/verde","imetec tritapiù tritatutto, 4 lame in acciaio inox, capiente contenitore 600 ml, 18.000 giri/min, funzionamento a pressione, 1000 w, materiali bpa free, bianco/verde",TRUE,165,165,TRUE,"TRUE"
"95","B08NPR8QNN","B08NPR8QNN",TRUE,"imetec tritacompact tritatutto, lame in acciaio inox, capienza contenitore 400 ml, funzionamento a pressione, compatto, 350 w, bianco e salvia","imetec tritacompact tritatutto, lame in acciaio inox, capienza contenitore 400 ml, funzionamento a pressione, compatto, 350 w, bianco e salvia",TRUE,142,142,TRUE,"TRUE"
"96","B08NPR9BYM","B08NPR9BYM",TRUE,"imetec frullarapido, frullatore a immersione, gambo xl in acciaio, lame in acciaio inox, funzionamento a impulsi, 450 w","imetec frullarapido, frullatore a immersione, gambo xl in acciaio, lame in acciaio inox, funzionamento a impulsi, 450 w",TRUE,119,119,TRUE,"TRUE"
"97","B08R7NM2SF","B08R7NM2SF",TRUE,"imetec tosta&griglia, tostiera elettrica, piastre xl per preparare 3 toast alla volta, compatta, riponibile in verticale, 800 w, spie di funzionamento","imetec tosta&griglia, tostiera elettrica, piastre xl per preparare 3 toast alla volta, compatta, riponibile in verticale, 800 w, spie di funzionamento",TRUE,150,150,TRUE,"TRUE"
"98","B08R7NSVL5","B08R7NSVL5",TRUE,"imetec grantoast, tostapane per toast extra farciti, fessure xl, pinze a fondo chiuso apribili a 360° e regolabili in larghezza, 600 w, 10 livelli doratura, timer","imetec grantoast, tostapane per toast extra farciti, fessure xl, pinze a fondo chiuso apribili a 360° e regolabili in larghezza, 600 w, 10 livelli doratura, timer",TRUE,162,162,TRUE,"TRUE"
"99","B08RYGFL21","B08RYGFL21",TRUE,"imetec frulla&gusta, frullatore con 4 lame in acciaio inox, bicchiare in vetro, 2 velocità e funzionamento impulsi, 500 w, capienza 800 ml, lavabile lavastoviglie, piedini antiscivolo","imetec frulla&gusta, frullatore con 4 lame in acciaio inox, bicchiare in vetro, 2 velocità e funzionamento impulsi, 500 w, capienza 800 ml, lavabile lavastoviglie, piedini antiscivolo",TRUE,183,183,TRUE,"TRUE"
"100","B08V11MR92","B08V11MR92",TRUE,"imetec eco perfect ferro da stiro a vapore, risultati ottimi con -35% di consumo di acqua e -25% di consumo energetico, piastra con rivestimento pro ceramic, tripla protezione anticalcare, 2400 w","imetec eco perfect ferro da stiro a vapore, risultati ottimi con -35% di consumo di acqua e -25% di consumo energetico, piastra con rivestimento pro ceramic, tripla protezione anticalcare, 2400 w",TRUE,195,195,TRUE,"TRUE"
"101","B08X6QMR36","B08X6QMR36",TRUE,"imetec onda f1, ferro da stiro a vapore con piastra a onde scorrevole brevettata, 2400 w, colpo di vapore 200g, serbatoio 300 ml, tripla protezione anticalcare","imetec onda f1, ferro da stiro a vapore con piastra a onde scorrevole brevettata, 2400 w, colpo di vapore 200g, serbatoio 300 ml, tripla protezione anticalcare",TRUE,159,159,TRUE,"TRUE"
"102","B08X7BYVZQ","B08X7BYVZQ",TRUE,"bellissima imetec my pro revolution bhs4 1100, spazzola ad aria calda, asciuga e modella, rotazione automatica a doppio verso, 2 spazzole da 40 e 50 mm, ionizzatore, 1000 w, rivestimento in ceramica","bellissima imetec my pro revolution bhs4 1100, spazzola ad aria calda, asciuga e modella, rotazione automatica a doppio verso, 2 spazzole da 40 e 50 mm, ionizzatore, 1000 w, rivestimento in ceramica",TRUE,198,198,TRUE,"TRUE"
"103","B08XBZV29G","B08XBZV29G",TRUE,"imetec grattugissima, grattuggia elettrica per formaggio, pane e frutta secca, contenitore estraibile, coperchio salvafreschezza, 150 w, rullo in acciacio, accessori lavabili in lavastoviglie","imetec grattugissima, grattuggia elettrica per formaggio, pane e frutta secca, contenitore estraibile, coperchio salvafreschezza, 150 w, rullo in acciacio, accessori lavabili in lavastoviglie",TRUE,191,191,TRUE,"TRUE"
"104","B093C19CSD","B093C19CSD",TRUE,"imetec salon expert p3 3600 asciugacapelli, motore professionale, 2200 w, ionizzatore, griglia ceramica e tormalina, 8 combinazioni aria temperatura, concentratore e diffusore professionali, nero","imetec salon expert p3 3600 asciugacapelli, motore professionale, 2200 w, ionizzatore, griglia ceramica e tormalina, 8 combinazioni aria temperatura, concentratore e diffusore professionali, nero",TRUE,195,195,TRUE,"TRUE"
"105","B0987B62CP","B0987B62CP",TRUE,"imetec silent power comfort, termoventilatore silenzioso e compatto, stufetta elettrica, 2100 w, 4 funzioni, termostato ambiente e di sicurezza, funzione antigelo, maniglia","imetec silent power comfort, termoventilatore silenzioso e compatto, stufetta elettrica, 2100 w, 4 funzioni, termostato ambiente e di sicurezza, funzione antigelo, maniglia",TRUE,172,172,TRUE,"TRUE"
"106","B0987BBB14","B0987BBB14",TRUE,"imetec eco ceramic diffusion, stufetta elettrica, termoventilatore, corpo oscillante, tecnologia ceramica, basso consumo energetico, 6 funzioni di temperatura, timer, bianco/nero","imetec eco ceramic diffusion, stufetta elettrica, termoventilatore, corpo oscillante, tecnologia ceramica, basso consumo energetico, 6 funzioni di temperatura, timer, bianco/nero",TRUE,178,178,TRUE,"TRUE"
"107","B0987BTDT2","B0987BTDT2",TRUE,"imetec silent power eco, termoventilatore silenzioso, stufetta elettrica, tecnologia eco -35% consumo energetico, 2100 w, funzione antigelo, temperatura regolabile, 4 funzioni, termostato ambiente","imetec silent power eco, termoventilatore silenzioso, stufetta elettrica, tecnologia eco -35% consumo energetico, 2100 w, funzione antigelo, temperatura regolabile, 4 funzioni, termostato ambiente",TRUE,196,196,TRUE,"TRUE"
"108","B0987C1JFD","B0987C1JFD",TRUE,"imetec eco ceramic, termoventilatore, stufetta elettrica, tecnologia ceramica, basso consumo energetico, silenzioso, 3 livelli di temperatura, termostato ambiente","imetec eco ceramic, termoventilatore, stufetta elettrica, tecnologia ceramica, basso consumo energetico, silenzioso, 3 livelli di temperatura, termostato ambiente",TRUE,162,162,TRUE,"TRUE"
"109","B0987C6H2S","B0987C6H2S",TRUE,"imetec silent power pure, termoventilatore silenzioso con ionizzatore e timer di autospegnimento, stufetta elettrica, 2100 w, funzione antigelo, temperatura regolabile, 4 funzioni","imetec silent power pure, termoventilatore silenzioso con ionizzatore e timer di autospegnimento, stufetta elettrica, 2100 w, funzione antigelo, temperatura regolabile, 4 funzioni",TRUE,179,179,TRUE,"TRUE"
"110","B0987CNV93","B0987CNV93",TRUE,"imetec eco rapid, stufa elettrica 2000 w, tecnologia a basso consumo energetico, termoconvettore 4 temperature, termostato ambiente, silenzioso","imetec eco rapid, stufa elettrica 2000 w, tecnologia a basso consumo energetico, termoconvettore 4 temperature, termostato ambiente, silenzioso",TRUE,143,143,TRUE,"TRUE"
"111","B0987D6J4J","B0987D6J4J",TRUE,"imetec compact air, termoventilatore piccolo e potente, stufetta elettrica, 2000 w, maniglia integrata, temperatura regolabile, funzione antigelo, dispositivo di protezione dai surriscaldamenti","imetec compact air, termoventilatore piccolo e potente, stufetta elettrica, 2000 w, maniglia integrata, temperatura regolabile, funzione antigelo, dispositivo di protezione dai surriscaldamenti",TRUE,193,193,TRUE,"TRUE"
"112","B0987D9K2X","B0987D9K2X",TRUE,"imetec silent power protection, termoventilatore silenzioso, 2100 w, stufetta elettrica, timer spegnimento programmabile, temperatura regolabile, 4 funzioni, termostato ambiente, funzione antigelo","imetec silent power protection, termoventilatore silenzioso, 2100 w, stufetta elettrica, timer spegnimento programmabile, temperatura regolabile, 4 funzioni, termostato ambiente, funzione antigelo",TRUE,196,196,TRUE,"TRUE"
"113","B09BHV4DWG","B09BHV4DWG",TRUE,"bellissima imetec air wonder, spazzola ad aria calda, tecnologia a ioni, spazzole rivestite in ceramica e cheratina, asciuga, dona volume, 8 accessori, 1000 w","bellissima imetec air wonder, spazzola ad aria calda, tecnologia a ioni, spazzole rivestite in ceramica e cheratina, asciuga, dona volume, 8 accessori, 1000 w",TRUE,158,158,TRUE,"TRUE"
"114","B09BJ7LNR6","B09BJ7LNR6",TRUE,"bellissima imetec steam elixir, piastra a vapore, capelli lisci in una sola passata senza danni, rivestimento in ceramica e olio argan, rapido riscaldamento, 4 temperature, tappetino termoresistente","bellissima imetec steam elixir, piastra a vapore, capelli lisci in una sola passata senza danni, rivestimento in ceramica e olio argan, rapido riscaldamento, 4 temperature, tappetino termoresistente",TRUE,198,198,TRUE,"TRUE"
"115","B09CTY5P2L","B09CTY5P2L",TRUE,"bellissima imetec creativity 4 you, asciugacapelli professionale, 4 accessori, diffusore, controllo intelligente della temperatura, ion technology, beauty bag, 2 velocità, 3 temperature, 1800 w","bellissima imetec creativity 4 you, asciugacapelli professionale, 4 accessori, diffusore, controllo intelligente della temperatura, ion technology, beauty bag, 2 velocità, 3 temperature, 1800 w",TRUE,193,193,TRUE,"TRUE"
"116","B09CTZ6WKM","B09CTZ6WKM",TRUE,"bellissima imetec gt22 150 accessorio mermaid waves per styler arricciacapelli twist&style, ferro riscaldato forma bubbles, diametro 25 mm, rivestimento in ceramica, temperatura 190°c","bellissima imetec gt22 150 accessorio mermaid waves per styler arricciacapelli twist&style, ferro riscaldato forma bubbles, diametro 25 mm, rivestimento in ceramica, temperatura 190°c",TRUE,183,183,TRUE,"TRUE"
"117","B09CTZF711","B09CTZF711",TRUE,"imetec intellisense comfort, termoforo multiuso, cuscino termico, per schiena e addome, tasca per mani, rapido riscaldamento, tessuto anallergico, 5 temperature, electro block di sicurezza, lavabile","imetec intellisense comfort, termoforo multiuso, cuscino termico, per schiena e addome, tasca per mani, rapido riscaldamento, tessuto anallergico, 5 temperature, electro block di sicurezza, lavabile",TRUE,198,198,TRUE,"TRUE"
"118","B09CTZM9LJ","B09CTZM9LJ",TRUE,"imetec intellisense xl, termoforo extra large schiena e gambe, cuscino termico, 38x50 cm, tessuto micro peluche, 5 temperature, electro block di sicurezza, riscaldamento rapido, lavabile in lavatrice","imetec intellisense xl, termoforo extra large schiena e gambe, cuscino termico, 38x50 cm, tessuto micro peluche, 5 temperature, electro block di sicurezza, riscaldamento rapido, lavabile in lavatrice",TRUE,199,199,TRUE,"TRUE"
"119","B09CTZV4TM","B09CTZV4TM",TRUE,"imetec intellisense cervical, termoforo per cervicale e spalle, cuscino termico, 47x52 cm, tessuto anallergico, 5 temperature, electro block di sicurezza, riscaldamento rapido, lavabile in lavatrice","imetec intellisense cervical, termoforo per cervicale e spalle, cuscino termico, 47x52 cm, tessuto anallergico, 5 temperature, electro block di sicurezza, riscaldamento rapido, lavabile in lavatrice",TRUE,198,198,TRUE,"TRUE"
"120","B09CTZZGFY","B09CTZZGFY",TRUE,"bellissima imetec gt22 160, accessorio hollywood waves per styler arricciacapelli twist&style, rivestimento in ceramica, temperatura 190°c, ovale, nero, diametro 38 x 25 mm","bellissima imetec gt22 160, accessorio hollywood waves per styler arricciacapelli twist&style, rivestimento in ceramica, temperatura 190°c, ovale, nero, diametro 38 x 25 mm",TRUE,172,172,TRUE,"TRUE"
"121","B09CYDKRZ6","B09CYDKRZ6",TRUE,"imetec frullafacile, frullatore a immersione, gambo xl, lame in acciaio inox, funzionamento a impulsi, bicchiere graduato da 700 ml bpa free, 800 w, impugnatura ergonomica","imetec frullafacile, frullatore a immersione, gambo xl, lame in acciaio inox, funzionamento a impulsi, bicchiere graduato da 700 ml bpa free, 800 w, impugnatura ergonomica",TRUE,171,171,TRUE,"TRUE"
"122","B09CYM6KR3","B09CYM6KR3",TRUE,"imetec frullarapido+, frullatore a immersione, gambo xl in acciaio, lame in acciaio inox, funzionamento a impulsi, bicchiere graduato da 700 ml bpa free, 800 w","imetec frullarapido+, frullatore a immersione, gambo xl in acciaio, lame in acciaio inox, funzionamento a impulsi, bicchiere graduato da 700 ml bpa free, 800 w",TRUE,159,159,TRUE,"TRUE"
"123","B09GTTY863","B09GTTY863",TRUE,"imetec scaldasonno adapto maxi coprimaterasso matrimoniale 195x165 cm, basso consumo, riscaldamento rapido, temperatura personalizzata, 100% cotone percalle trapuntato, doppio comando, 6 temperature","imetec scaldasonno adapto maxi coprimaterasso matrimoniale 195x165 cm, basso consumo, riscaldamento rapido, temperatura personalizzata, 100% cotone percalle trapuntato, doppio comando, 6 temperature",TRUE,198,198,TRUE,"TRUE"
"124","B09K7ZS81N","B09K7ZS81N",TRUE,"imetec friggileggero, friggitrice ad aria multifunzione, 12 programmi, riscaldamento rapido, 18 l, 1550 w, comandi digitali, cestello, griglia, leccarda, ricettario, 40x36x34,5 cm","imetec friggileggero, friggitrice ad aria multifunzione, 12 programmi, riscaldamento rapido, 18 l, 1550 w, comandi digitali, cestello, griglia, leccarda, ricettario, 40x36x34,5 cm",TRUE,179,179,TRUE,"TRUE"
"125","B09KV6G5KT","B09KV6G5KT",TRUE,"imetec intellisense comfort, termoforo multiuso, cuscino termico, tessuto anallergico, 5 temperature, electro block di sicurezza, lavabile, grigio, 40x35 cm","imetec intellisense comfort, termoforo multiuso, cuscino termico, tessuto anallergico, 5 temperature, electro block di sicurezza, lavabile, grigio, 40x35 cm",TRUE,156,156,TRUE,"TRUE"
"126","B09N2JV9X3","B09N2JV9X3",TRUE,"imetec pro, bilancia pesapersone meccanica, rileva il peso in modo chiaro e affidabile, pedana antiscivolo, portata max 150 kg, divisione 1 kg","imetec pro, bilancia pesapersone meccanica, rileva il peso in modo chiaro e affidabile, pedana antiscivolo, portata max 150 kg, divisione 1 kg",TRUE,142,142,TRUE,"TRUE"
