"","asin","asin_2","name"
"1","B07JVLQ38M","B07JVLQ38M","Imetec Bellissima My Pro Ceramic P5 3800 Asciugacapelli Professionale Per Capelli Morbidi E Luminosi, Tecnologia Ceramica, 2300 W, Nero Oro"
"2","B08LVXG2V1","B08LVXG2V1","Bellissima Imetec Diffon Ceramic, Diffusore ad Aria Calda per Capelli Ricci, Tecnologia Ceramica, 700 W, 2 Combinazioni Aria/Temperatura, Asciugatura Delicata Senza Effetto Crespo"
"3","B07Y8DPHCL","B07Y8DPHCL","Bellissima Imetec P3 3400 Asciugacapelli con Motore AC professionale, Tecnologia a Ioni per Capelli morbidi, Idratati e Luminosi, Griglia Rivestita in Ceramica, 2400 W di Potenza"
"4","B082WSYYCX","B082WSYYCX","Bellissima Imetec Asciugacapelli K9 2300 Asciuga e Mantiene Idratati i Capelli senza Effetto Crespo, 2300 W, Tecnologia a Ioni, 8 Combinazioni Flusso d'Aria Temperatura, Diffusore capellli ricci"
"5","B082WSZXHB","B082WSZXHB","Bellissima Imetec Asciugacapelli S9 2200 Asciuga e Modella con Precisione, 2200 W, 8 Combinazioni Flusso d'Aria Temperatura, Beccussio di precisione, Colpo aria fredda"
"6","B09CTY5P2L","B09CTY5P2L","Bellissima Imetec Creativity 4 You, Asciugacapelli Professionale, 4 Accessori, Diffusore, Controllo Intelligente della temperatura, Ion Technology, Beauty Bag, 2 velocità, 3 temperature, 1800 W"
"7","B09SGB55N4","B09SGB55N4","Bellissima Imetec Diffon Supreme, Diffusore ad Aria Calda per Capelli Ricci, Diffusore XL con 12 Dita, Tecnologia Ceramica&Argan Oil, 2 Velocità, 3 Temperature, Ionizzatore, Asciugatura Delicata"
"8","B015O6A6GM","B015O6A6GM","Bellissima Imetec P11 2300 Asciugacapelli Professionale, 2300 W, Rivestimento in Ceramica e Tormalina, 8 Combinazioni Aria/Temperatura, Beccuccio Stretto, Diffusore capelli ricci"
"9","B00G3DNXIE","B00G3DNXIE","Bellissima Imetec S5 2200 Asciugacapelli, 2200 W, per un'Asciugatura Rapida e Styling a Lunga Durata, 8 Combinazioni Aria/Temperatura, Colpo d'Aria Fredda"
"10","B07Y8DHN3F","B07Y8DHN3F","Imetec ECO SE9 1000 Asciugacapelli con Tecnologia Eco Technology 1400 W, Consumo Energetico Ridotto, 8 Combinazioni Aria/Temperatura, Diffusore per Capelli Ricci"
"11","B015O6AFPE","B015O6AFPE","Imetec C20 2100 Asciugacapelli, 2100 W, Beccuccio Orientabile, Diffusore Professionale, Funzione Fast Drying per un'Asciugatura Rapida, 4 Combinazioni Aria/Temperatura, Colpo Aria Fredda, Cavo 1.8 m"
"12","B00O4QVS66","B00O4QVS66","Imetec Bellissima P2 2200 Asciugacapelli Professionale, Potenza 2200 W, Tecnologia a Ioni per Idratare i Capelli e Ridurre l'Effetto Crespo, 8 Combinazioni Aria/Temperatura, Beccuccio Stretto"
"13","B093C19CSD","B093C19CSD","Imetec Salon Expert P3 3600 Asciugacapelli, Motore Professionale, 2200 W, Ionizzatore, Griglia Ceramica e tormalina, 8 combinazioni aria temperatura, Concentratore e Diffusore Professionali, Nero"
"14","B079Z9GXQS","B079Z9GXQS","Imetec Salon Expert P5 3600 Asciugacapelli Professionale, 2300 W, Griglia con Rivestimento in Ceramica e Cheratina, Tecnologia a Ioni, 8 Combinazioni Aria/Temperatura, 2 Beccucci"
"15","B09ZJ9QXZY","B09ZJ9QXZY","Bellissima Imetec Creativity Ceramic & Tourmaline, Piastra per Capelli, Liscio o Mosso, Rivestimento in Ceramica e tormalina, Regolazione Temperatura da 150-230°C, Riscaldamento Rapido"
"16","B07S5L9937","B07S5L9937","Bellissima Imetec My Pro Creativity Infrared B8 200, piastra lisciante, tecnologia raggi infrarossi, rivestimento in ceramica e cheratina, 11 livelli di temperatura da 130 °C a 230 °C, cavo 1,8 m"
"17","B07FZ4PVRP","B07FZ4PVRP","Bellissima Imetec Steam B28 100 Piastra per Capelli Professionale a Vapore, Effetto Liscio a Lungo, Ceramica, Temperatura Regolabile 170°C - 200°C - 230°C, Riscaldamento Rapido"
"18","B072MSQDQG","B072MSQDQG","Bellissima Imetec B26 100 Piastra per Capelli Lunghi o Difficili da Disciplinare, Formato Extra Large, Rivestimento in Ceramica, 160° C - 230° C"
"19","B00RP0J7AW","B00RP0J7AW","Bellissima Imetec B9 100 Piastra per Capelli, Piastra extralunghe, Riscaldamento Rapido, Multivoltaggio Automatico, Temperatura 210°, cavo giravole"
"20","B00VYLJ4H4","B00VYLJ4H4",NA
"21","B015O6A68K","B015O6A68K","Bellissima Imetec Creativity B9 400 Piastra Per Capelli, Styling Liscio O Mosso, Grigio"
"22","B079FN8N4T","B079FN8N4T","Bellissima Imetec BM 200 Piastra Mini per Capelli Lisci e Luminosi, Temperatura 200°, Multivoltaggio Automatico, Dimensioni Compatte da Viaggio"
"23","B00HLUUNOK","B00HLUUNOK","Bellissima Imetec Creativity B15 50 Piastra per Capelli, Styling Liscio o Mosso, Rivestimento in Nanoceramica, Regolazione della Temperatura da 140°C a 230°C, Piastre Oscillanti"
"24","B075RGG4Y5","B075RGG4Y5","Bellissima Imetec Creativity B27 100 Piastra Per Capelli Con Rivestimento In Ceramica E Controllo Della Temperatura, Temperatura Egolabile 150°C / 230°C, Multicolore"
"25","B01N55NF5G","B01N55NF5G","Bellissima Imetec Creativity Color Shine B22 100 Piastra per Capelli Colorati, Rivestimento in Tessuto per la Protezione dei Capelli, temperatura regolabile da 150°C a 230°C"
"26","B06WP9PPT6","B06WP9PPT6","Bellissima Imetec Intellisense B24 100 Piastra per Capelli Lisci e Mossi a 60° C in Meno con Tecnologia Intellistyle, Rivestimento in Ceramica, 5 Livelli di Temperatura"
"27","B09BJ7LNR6","B09BJ7LNR6","Bellissima Imetec Steam Elixir, Piastra a Vapore, Capelli lisci in Una Sola Passata Senza Danni, Rivestimento in Ceramica e Olio Argan, Rapido Riscaldamento, 4 Temperature, Tappetino Termoresistente"
"28","B07FYHM3QY","B07FYHM3QY","Bellissima Imetec Magic Straight Brush PB11 100 Spazzola Elettrica Lisciante, 3 Lati Esterni Riscaldati, Spegnimento automatico, Tecnologia a Ioni, Ceramica, 160 C°- 210°C, Nero/Oro rosa"
"29","B07S5L8VYG","B07S5L8VYG","Bellissima Imetec Magic Style Brush P2 30 Spazzola Riscaldata, Capelli Liscio Effetto Naturale/Mosso Sostenuto, Diametro 30 mm, Tecnologia a Ioni, Rivestimento Ceramica, Nero/Oro rosa"
"30","B06WGV3DBP","B06WGV3DBP","Bellissima Imetec Beach Waves Gt20 100 Piastra Per Capelli A Onde Larghe E Strette, Effetto Naturale, Rosa"
"31","B08NKXBJX1","B08NKXBJX1",NA
"32","B08X7BYVZQ","B08X7BYVZQ","Bellissima Imetec My Pro Revolution Bhs4 1100, Spazzola Ad Aria Calda, Nero E Oro Rosa"
"33","B07W3VJQZD","B07W3VJQZD","Bellissima Imetec GH18 1100 Modellatore ad Aria, Rivestimento spazzole in Ceramica, 5 Accessori per Realizzare Capelli Lisci e Luminosi, a Onde morbide o Ricci Stretti, 1000 W"
"34","B08J8XH5BH","B08J8XH5BH","Bellissima Imetec Twist & Style GT22 100, Manico per Styler Arricciacapelli per Onde e Ricci, Temperatura Automatica, Riscaldamento Rapido, Orientabile a 90°, Accessori non Inclusi"
"35","B08J8XNFNC","B08J8XNFNC","Bellissima Imetec GT22 110, Accessorio Soft Curls per Styler Arricciacapelli Twist & Style, Ferro Riscaldato da 25 mm, Rivestimento in Ceramica, Temperatura 185°C"
"36","B08J8XCSH4","B08J8XCSH4","Bellissima Imetec GT22 120, Accessorio Sculpted Curls per Styler Arricciacapelli Twist & Style, Ferro Riscaldato da 11 mm, Rivestimento in Ceramica, Temperatura 185°C"
"37","B08J8XCSHB","B08J8XCSHB",NA
"38","B08J8XN21F","B08J8XN21F","Bellissima Imetec GT22 140 Accessorio Glamour Waves per Styler Arricciacapelli Twist&Style, Ferro Riscaldato Forma Conica, Diametro 13/38 mm, Rivestimento in Ceramica, Temperatura 190°C"
"39","B09CTZ6WKM","B09CTZ6WKM","Bellissima Imetec GT22 150 Accessorio Mermaid Waves per Styler Arricciacapelli Twist&Style, Ferro Riscaldato Forma Bubbles, Diametro 25 mm, Rivestimento in Ceramica, Temperatura 190°C"
"40","B09CTZZGFY","B09CTZZGFY",NA
"41","B09BHV4DWG","B09BHV4DWG","Bellissima Imetec Air Wonder, Spazzola ad Aria Calda, Tecnologia a ioni, Spazzole Rivestite in Ceramica e Cheratina, Asciuga, Dona Volume, 8 Accessori, 1000 W"
"42","B00N4K5PDK","B00N4K5PDK","Bellissima Imetec GH16 400 Spazzola ad Aria Modellante con 2 Accessori di Styling, Diametro 25 mm, Potenza 400 W, 2 Combinazioni Flusso d'Aria/Temperatura, Puntale Antiscottatura"
"43","B00SKVYB6K","B00SKVYB6K","Bellissima Imetec GT13 50 Arricciacapelli, Rivestimento in Ceramica, 7 Diversi Livelli di Temperatura da 150°C a 210°C, Diametro di 25 mm, Riscaldamento Rapido, Pronto all'Uso"
"44","B075RFR2CV","B075RFR2CV","Bellissima Imetec GT15 200 Ferro Arricciacapelli con Rivestimento in Ceramica, Forma Conica, Controllo della Temperatura"
"45","B00VRGPXF8","B00VRGPXF8","Bellissima Imetec GT15 100 Arricciacapelli, Ricci Brillanti e Definiti, Diametro 19 mm, Rivestimento in Ceramica, Riscaldamento Rapido, Pronto all'Uso"
"46","B0B9HC9HSR","B0B9HC9HSR",NA
"47","B0987B62CP","B0987B62CP","Imetec Silent Power Comfort, Termoventilatore silenzioso e compatto, Stufetta Elettrica, 2100 W, 4 funzioni, termostato ambiente e di sicurezza, funzione antigelo, maniglia"
"48","B0987BTDT2","B0987BTDT2","Imetec Silent Power Eco , Termoventilatore silenzioso, Stufetta Elettrica, tecnologia ECO, 2100 W, funzione antigelo, temperatura regolabile, 4 funzioni, termostato ambiente"
"49","B0987C6H2S","B0987C6H2S","Imetec Silent Power Pure, Termoventilatore silenzioso con ionizzatore e timer di autospegnimento, Stufetta Elettrica, 2100 W, funzione antigelo, temperatura regolabile, 4 funzioni"
"50","B0987D9K2X","B0987D9K2X","Imetec Silent Power Protection, Termoventilatore silenzioso, 2100 W, Stufetta Elettrica, Timer spegnimento programmabile, temperatura regolabile, 4 funzioni, termostato ambiente, funzione antigelo"
"51","B0987D6J4J","B0987D6J4J","Imetec Compact Air, Termoventilatore piccolo e potente, Stufetta Elettrica, 2000 W, maniglia integrata, temperatura regolabile, funzione antigelo, dispositivo di protezione dai surriscaldamenti"
"52","B0987C1JFD","B0987C1JFD","Imetec Eco Ceramic, Termoventilatore, Stufetta elettrica, Tecnologia Ceramica, Basso Consumo Energetico, Silenzioso, 3 Livelli di Temperatura, Termostato Ambiente"
"53","B0987CNV93","B0987CNV93","Imetec Eco Rapid, Stufa Elettrica 2000 W, Tecnologia a Basso Consumo Energetico, Termoconvettore 4 Temperature, Termostato Ambiente, Silenzioso"
"54","B0987BBB14","B0987BBB14","Imetec Eco Ceramic Diffusion, Stufetta elettrica, Termoventilatore, Corpo Oscillante, Tecnologia Ceramica, Basso Consumo Energetico, 6 Funzioni di Temperatura, Timer, Bianco/Nero"
"55","B00FM266R2","B00FM266R2","Imetec Dolcevita ES4 Bilancia Elettronica da Cucina, Pesa Solidi e Liquidi, Contenitore Estraibile, Scala Graduata, Portata 5 Kg, Divisione 1 g, Funzione Tara, Display Digitale, Spegnimento Automatico"
"56","B076998CD8","B076998CD8",NA
"57","B08JVC7VB4","B08JVC7VB4","Imetec Crea&Crema Sbattitore Elettrico, Fruste Extralunghe per Impasti Dolci e Panna Montata, Ganci Acciaio Inox per Impastare, 5 Velocità, Funzione Turbo, Design Ergonomico, 500 W"
"58","B08R7NM2SF","B08R7NM2SF","Imetec Tosta&Griglia, Tostiera Elettrica, Riponibile In Verticale, 800 W, Multicolore"
"59","B08JV8L49M","B08JV8L49M",NA
"60","B08R7NSVL5","B08R7NSVL5","Imetec GranToast, tostapane per toast extra farciti, fessure XL, pinze a fondo chiuso apribili a 360° e regolabili in larghezza, 600 W, 10 livelli doratura, Timer"
"61","B08NPR8QNN","B08NPR8QNN","Imetec TritaCompact Tritatutto, Lame in Acciaio Inox, Capienza Contenitore 400 ml, Funzionamento a Pressione, Compatto, 350 W, Bianco e Salvia"
"62","B08NPMMFWQ","B08NPMMFWQ","Imetec Tritapiù Tritatutto, 4 Lame in Acciaio Inox, Capiente Contenitore 600 ml, 18.000 Giri/min, Funzionamento a Pressione, 1000 W, Materiali BPA Free, Bianco/Verde"
"63","B00IRAFHB2","B00IRAFHB2","Bellissima Imetec Kit Testine di Ricambio Face Cleansing per Pelli Normali e Pelli Sensibili, 4 Diverse Testine per Detergere, Massaggiare, Levigare e Idratare La Pelle"
"64","B00A9269R2","B00A9269R2","Imetec Scaldaletto Singolo, Comando 2 Temperature, Tessuto Trapuntato, Lavabile a Mano e in Lavatrice a 40° C, 150 x 80 cm"
"65","B07Y8GR1WS","B07Y8GR1WS","Imetec Scaldasonno Adapto Singolo 150 x 80 Cm, Tecnologia Brevettata, Riscaldamento Rapido, Temperatura Costante e Personalizzata, 100% Cotone, Comando con 6 Temperature"
"66","B07Y8GQMP5","B07Y8GQMP5","Imetec Scaldasonno Adapto Singolo 150 x 80 Cm, Riscaldamento Rapido, Temperatura Costante e Personalizzata, 100% Lana e Merino, tessuto antiscivolo, Comando con 6 Temperature"
"67","B08J8XMFQN","B08J8XMFQN","Imetec Scaldasonno Adapto Maxi Coprimaterasso Matrimoniale 195 x 165 cm, Riscaldamento Rapido, Temperatura Costante e Personalizzata, 100% Lana e Merino, Doppio Comando, 6 Temperature"
"68","B0056BZZDA","B0056BZZDA","Imetec Scaldasonno Singolo 150x80 cm, 50% Lana e Merino, 2 Temperature, Dispositivo Sicurezza Electro Block, Made in Italy"
"69","B078RL1X78","B078RL1X78","Imetec BW03 Boule Elettrica Cordless, Tecnologia Ceramica, Riscaldamento Ultrarapido, Termostato di Sicurezza, Spia di Ricarica"
"70","B0B8JFYZ34","B0B8JFYZ34","Imetec Scaldapiedi, Tecnologia Intellisense, Tessuto Morbido, Comando Digitale a 5 Temperature, Autospegnimento, Dispositivo di Sicurezza Electro Block, Rivestimento Lavabile in Lavatrice, 52x54 cm"
"71","B07VC16GW8","B07VC16GW8","Imetec Compact ES1 100 Bilancia pesapersone elettronica compatta, Design ultrasottile, Ampio LCD display, Portata Max 150 kg"
"72","B07W4JVN8S","B07W4JVN8S","Imetec Monitoring ES9 300 Bilancia Pesapersone Elettronica, Monitoraggio Trend Grafico Peso, 4 Utenti, fino a 180 Kg, LCD Display, Vetro Temperato, Grigio Scuro"
"73","B09N2JV9X3","B09N2JV9X3","Imetec Pro, Bilancia Pesapersone Analogica, rileva il peso in modo chiaro e affidabile, pedana antiscivolo, portata max 150 kg, divisione 1 kg, funzionamento meccanico"
"74","B07WBZC85N","B07WBZC85N","Imetec Precision ES13 200 Bilancia pesapersone elettronica, rivela anche le minime variazioni di peso, fino a 180 Kg, LCD Display, vetro temperato, batterie incluse"
"75","B07VGH4Z81","B07VGH4Z81","Imetec Body Analizer ES7 400 Bilancia Pesapersone Diagnostica, Misura Acqua Corporea, Massa Muscolare e Grassa"
"76","B00GLSDCS2","B00GLSDCS2","Imetec Nuvola Ferro da Stiro da Viaggio a Vapore, Piastra in Acciaio Inossidabile da 1000 W, Custodia da Viaggio, Doppio Voltaggio"
"77","B07CKY9SNZ","B07CKY9SNZ","Imetec ZeroCalc Z1 2500 Ferro da Stiro, Tecnologia Anticalcare, Piastra Inox 2200 W, Colpo Vapore 120 g"
"78","B07MZGRDJ4","B07MZGRDJ4","Imetec Zerocalc Z3 3700 Ferro da Stiro, Tecnologia Anticalcare, Piastra Ceramica ad Alta Scorrevolezza, 2400W, Colpo Vapore 160 G, 0,3 litri, Dispositivo Antigoccia Tecnologia a Risparmio Energetico"
"79","B07NYRRF1Y","B07NYRRF1Y","Imetec ZeroCalc Z3 3900 Ferro da Stiro a Vapore, Tecnologia Anticalcare, Tecnologia Intellivapor (temperatura unica ideale per tutti i tessuti), Piastra Ceramica, 2400 W, Colpo Vapore 170 g"
"80","B07CKRCMB7","B07CKRCMB7","Imetec Zerocalc Z3 3500 Ferro Da Stiro, Tecnologia Anticalcare, Piastra Inox 2400 W, Colpo Vapore 150 G, Bianco Blu"
"81","B08V11MR92","B08V11MR92","Imetec Eco Perfect Ferro da Stiro a Vapore, Risultati Ottimi con -35% di Consumo di Acqua e -25% di Consumo Energetico, Piastra con Rivestimento Pro Ceramic, Tripla Protezione Anticalcare, 2400 W"
"82","B08X6QMR36","B08X6QMR36","Imetec Onda F1, Ferro da Stiro a Vapore con Piastra a Onde Scorrevole Brevettata, 2400 W, Colpo di Vapore 200g, Serbatoio 300 ml, Tripla Protezione Anticalcare"
"83","B09SDHHKJZ","B09SDHHKJZ","Imetec Intellifast, ferro da stiro a vapore, Tecnologia Intelli System, Impostazione automatica della temperatura, Piastra Ceramic Diamond, Protezione anticalcare, 2400 W, Colpo Vapore 200 g"
"84","B0BCPB5TYQ","B0BCPB5TYQ","Imetec Activation Ferro da Stiro a Vapore, Piastra Scorrevole in Ceramica e Tormalina, Colpo Vapore 200 g, Tecnologia Anticalcare ZeroCalc, Antigoccia, Eco, 2400 W"
"85","B07S61V42S","B07S61V42S","Imetec ZeroCalc KF1 100 Kit 3 filtri anticalcare per Ferri da Stiro Imetec ZeroCalc Pro Ceramic PS2 2400, PS2 2000, PS2 2200, Intellivapor PS3 3000, Imetec Onda, Ricambi Originali"
"86","B0B1QV8TWC","B0B1QV8TWC","Imetec Rapidvapor Ferro da Stiro Generatore di Vapore, Piastra Fluid Ceramic a Rapido Riscaldamento, Leggero, Sistema di Pulizia Calc Clean, Colpo Vapore 240 g, 2400 W, 5 Bar Pump"
